,Combined Print & E-Book Fiction,Hardcover Fiction,Paperback Trade Fiction,Paperback Mass-Market Fiction,E-Book Fiction,Combined Print & E-Book Nonfiction,Hardcover Nonfiction,Paperback Nonfiction,E-Book Nonfiction,"Advice, How-To & Miscellaneous",Hardcover Graphic Books,Paperback Graphic Books,Manga,Children’s Middle Grade,Children’s Picture Books,Children’s Series,Young Adult,Animals,Business,Celebrities,Crime and Punishment,Culture,Education,"Fashion, Manners and Customs",Food and Diet,Games and Activities,Health,Humor,Love and Relationships,Parenthood and Family,Politics and American History,"Religion, Spirituality and Faith",Science,Sports and Fitness,Travel
1,GONE GIRL;by Gillian Flynn;97 weeks on the list,BURN;by James Patterson and Michael Ledwidge;New this week,GONE GIRL;by Gillian Flynn;24 weeks on the list,,,KILLING PATTON;by Bill O'Reilly and Martin Dugard;2 weeks on the list,KILLING PATTON;by Bill O'Reilly and Martin Dugard;2 weeks on the list,UNBROKEN;by Laura Hillenbrand;10 weeks on the list,NOT THAT KIND OF GIRL;by Lena Dunham;New this week,"YOU CAN, YOU WILL;by Joel Osteen;New this week","INJUSTICE: GODS AMONG US YEAR 2, VOL. 1;by Tom Taylor, Bruno Redondo and others;New this week",SISTERS;by Raina Telgemeier;7 weeks on the list,"MOBILE SUIT GUNDAM: THE ORIGIN, VOL. 7;by Yoshikazu Yasuhiko;New this week",UNCOMFORTABLE CONVERSATIONS WITH A BLACK BOY;by Emmanuel Acho;New this week,THE DAY THE CRAYONS QUIT;by Drew Daywalt. Illustrated by Oliver Jeffers;67 weeks on the list,THE MAZE RUNNER;by James Dashner;104 weeks on the list,REALM BREAKER;by Victoria Aveyard;New this week,THE DOG LIVED (AND SO WILL I);by Teresa J. Rhyne;,ZERO TO ONE;by Peter Thiel with Blake Masters;,STILL FOOLIN' 'EM;by Billy Crystal;,ORANGE IS THE NEW BLACK;by Piper Kerman;,BAD FEMINIST;by Roxane Gay;,THE ORGANIZED MIND;by Daniel J. Levitin;,"HOW TO BE PARISIAN WHEREVER YOU ARE;by Anne Berest, Audrey Diwan, Caroline de Maigret and Sophie Mas;",100 DAYS OF REAL FOOD;by Lisa Leake;,"MINECRAFT: ESSENTIAL HANDBOOK;Stephanie Milton with Paul Soares, Jr. and Jordan Maron;",SMOKE GETS IN YOUR EYES;by Caitlin Doughty;,DIARY OF A MAD DIVA;by Joan Rivers;,THE FIVE LOVE LANGUAGES;by Gary Chapman;,WHAT TO EXPECT WHEN YOU'RE EXPECTING;by Heidi Murkoff and Sharon Mazel;,KILLING PATTON;by Bill O'Reilly and Martin Dugard;,WHAT I KNOW FOR SURE;by Oprah Winfrey;,WHAT IF?;by Randall Munroe;,UNBROKEN;by Laura Hillenbrand;,WILD;by Cheryl Strayed;
2,BURN;by James Patterson and Michael Ledwidge;New this week,EDGE OF ETERNITY;by Ken Follett;3 weeks on the list,THE ALCHEMIST;by Paulo Coelho;324 weeks on the list,,,NOT THAT KIND OF GIRL;by Lena Dunham;New this week,NOT THAT KIND OF GIRL;by Lena Dunham;New this week,THE BOYS IN THE BOAT;by Daniel James Brown;19 weeks on the list,KILLING PATTON;by Bill O'Reilly and Martin Dugard;2 weeks on the list,THE SKINNYTASTE COOKBOOK;by Gina Homolka with Heather K. Jones;New this week,CAN'T WE TALK ABOUT SOMETHING MORE PLEASANT?;by Roz Chast;22 weeks on the list,"GUARDIANS OF THE GALAXY: THE COMPLETE COLLECTION, VOL. 1;by Dan Abnett, Andy Lanning and others;4 weeks on the list","FAIRY TAIL, VOL. 42;by Hiro Mashima;New this week",WILLA OF DARK HOLLOW;by Robert Beatty;New this week,THE BOOK WITH NO PICTURES;by B.J. Novak;New this week,DIVERGENT;by Veronica Roth;50 weeks on the list,RULE OF WOLVES;by Leigh Bardugo;6 weeks on the list,ANIMAL WISE;by Virginia Morell;,OUTLIERS;by Malcolm Gladwell;,ELVIS AND GINGER;by Ginger Alden;,MANSON;by Jeff Guinn;,COSBY: HIS LIFE AND TIMES;by Mark Whitaker;,THEY SAY / I SAY;by Gerald Graff and Cathy Birkenstein;,FLEA MARKET FABULOUS;by Lara Spencer;,10-DAY GREEN SMOOTHIE CLEANSE;by J. J. Smith;,PLAYER'S HANDBOOK;by Wizards RPG Team;,THE HOT ZONE;by Richard Preston;,STILL FOOLIN' 'EM;by Billy Crystal;,AN INVISIBLE THREAD;by Laura L. Schroff;,THE CONSCIOUS PARENT;by Shefali Tsabary;,UNBROKEN;by Laura Hillenbrand;,THE MYSTERY OF THE SHEMITAH;by Jonathan Cahn;,IN THE KINGDOM OF ICE;by Hampton Sides;,THE BOYS IN THE BOAT;by Daniel James Brown;,"HOW TO BE PARISIAN WHEREVER YOU ARE;by Anne Berest, Audrey Diwan, Caroline de Maigret and Sophie Mas;"
3,THE LOST KEY;by Catherine Coulter and J. T. Ellison;New this week,SOMEWHERE SAFE WITH SOMEBODY GOOD;by Jan Karon;5 weeks on the list,THE BEST OF ME;by Nicholas Sparks;32 weeks on the list,,,THE BOYS IN THE BOAT;by Daniel James Brown;20 weeks on the list,WHAT IF?;by Randall Munroe;5 weeks on the list,WILD;by Cheryl Strayed;80 weeks on the list,THE BOYS IN THE BOAT;by Daniel James Brown;37 weeks on the list,ZERO TO ONE;by Peter Thiel with Blake Masters;3 weeks on the list,SECONDS;by Bryan Lee O'Malley;12 weeks on the list,SMILE;by Raina Telgemeier;121 weeks on the list,"ATTACK ON TITAN, VOL. 1;by Hajime Isayama;69 weeks on the list",BECOMING: ADAPTED FOR YOUNG READERS;by Michelle Obama;10 weeks on the list,"GOODNIGHT, GOODNIGHT, CONSTRUCTION SITE;by Sherri Duskey Rinker and Tom Lichtenheld;157 weeks on the list",DORK DIARIES;by Rachel Renée Russell;106 weeks on the list,CONCRETE ROSE;by Angie Thomas;17 weeks on the list,"PAW PRINTS IN OMAN: DOGS, MOGS AND ME;by Charlotte Smith;",THIS CHANGES EVERYTHING;by Naomi Klein;,BOSSYPANTS;by Tina Fey;,MY BELOVED WORLD;by Sonia Sotomayor;,CAPOTE;by Gerald Clarke;,DATACLYSM;by Christian Rudder;,"WOMEN IN CLOTHES;by Sheila Heti, Heidi Julavits, Leanne Shapton & 639 Others;",THE ALL-DAY ENERGY DIET;by Yuri Elkaim;,MINECRAFT: CONSTRUCTION HANDBOOK;by Matthew Needler and Phil Southam;,THE DOG LIVED (AND SO WILL I);by Teresa J. Rhyne;,I HATE EVERYONE...STARTING WITH ME;by Joan Rivers;,DARING GREATLY;by Brené Brown;,THE GLASS CASTLE;by Jeannette Walls;,13 HOURS;by Mitchell Zuckoff with members of the Annex Security Team;,JESUS ON TRIAL;by David Limbaugh;,QUIET;by Susan Cain;,THE TERRIBLE AND WONDERFUL REASONS WHY I RUN LONG DISTANCES;by The Oatmeal;,TALES OF A FEMALE NOMAD;by Rita Golden Gelman;
4,THE BEST OF ME;by Nicholas Sparks;5 weeks on the list,PERSONAL;by Lee Child;5 weeks on the list,ORPHAN TRAIN;by Christina Baker Kline;59 weeks on the list,,,UNBROKEN;by Laura Hillenbrand;173 weeks on the list,HOW WE GOT TO NOW;by Steven Johnson;New this week,THE POWER OF HABIT;by Charles Duhigg;39 weeks on the list,HOW WE GOT TO NOW;by Steven Johnson;New this week,"ACT LIKE A SUCCESS, THINK LIKE A SUCCESS;by Steve Harvey;4 weeks on the list",SUGAR SKULL;by Charles Burns;3 weeks on the list,"AMULET, VOL. 6;by Kazu Kibuishi;7 weeks on the list","NORAGAMI, VOL. 1;by Adachitoka;4 weeks on the list",THE ONE AND ONLY BOB;by Katherine Applegate. Illustrated by Patricia Castelao;53 weeks on the list,PRESS HERE;by Hervé Tullet;160 weeks on the list,GIVER QUARTET;by Lois Lowry;59 weeks on the list,FIREKEEPER'S DAUGHTER;by Angeline Boulley;8 weeks on the list,THE GRUMPY GUIDE TO LIFE;by Grumpy Cat staff;,"THINKING, FAST AND SLOW;by Daniel Kahneman;",COSBY: HIS LIFE AND TIMES;by Mark Whitaker;,WORKING STIFF;by Judy Melinek and T. J. Mitchell;,GENGHIS KHAN AND THE MAKING OF THE MODERN WORLD;by Jack Weatherford;,THE TEACHER WARS;by Dana Goldstein;,TOSS THE GLOSS;by Andrea Q. Robinson and Chesley McLaren;,IT STARTS WITH FOOD;by Dallas and Melissa Hartwig;,HACKS FOR MINECRAFTERS;by Megan Miller;,UNHOOKED;by Frederick Woolverton and Susan Shapiro;,BOSSYPANTS;by Tina Fey;,TALES OF A FEMALE NOMAD;by Rita Golden Gelman;,HOW TO TALK SO KIDS WILL LISTEN AND LISTEN SO KIDS WILL TALK;by Adele Faber and Elaine Mazlish;,WORLD ORDER;by Henry Kissinger;,THE BEST YES;by Lysa TerKeurst;,THIS CHANGES EVERYTHING;by Naomi Klein;,BUSHCRAFT 101;by Dave Canterbury;,THE ULTIMATE SURVIVAL GUIDE;by Chris McNab;
5,EDGE OF ETERNITY;by Ken Follett;3 weeks on the list,ALL THE LIGHT WE CANNOT SEE;by Anthony Doerr;22 weeks on the list,DARK PLACES;by Gillian Flynn;62 weeks on the list,,,HOW WE GOT TO NOW;by Steven Johnson;New this week,THE SENSE OF STYLE;by Steven Pinker;New this week,HEAVEN IS FOR REAL;by Todd Burpo with Lynn Vincent;203 weeks on the list,UNBROKEN;by Laura Hillenbrand;192 weeks on the list,THE TERRIBLE AND WONDERFUL REASONS WHY I RUN LONG DISTANCES;by The Oatmeal;New this week,KILL MY MOTHER;by Jules Feiffer;7 weeks on the list,DRAMA;by Raina Telgemeier;64 weeks on the list,"ATTACK ON TITAN, VOL. 13;by Hajime Isayama;6 weeks on the list",THE ICKABOG;by J.K. Rowling;26 weeks on the list,MIX IT UP!;by Hervé Tullet;3 weeks on the list,SPIRIT ANIMALS;by various authors;3 weeks on the list,ONE OF US IS LYING;by Karen M. McManus;171 weeks on the list,DOGS I HAVE MET AND THE PEOPLE THEY FOUND;by Ken Foster;,THE POWER OF HABIT;by Charles Duhigg;,IS EVERYONE HANGING OUT WITHOUT ME?;by Mindy Kaling;,LAW OF THE JUNGLE;by Paul M. Barrett;,GEEK SUBLIME;by Vikram Chandra;,HOW CHILDREN SUCCEED;by Paul Tough;,THE BEAUTY DETOX DIET;by the editors of Rockridge Press;,GRAIN BRAIN;by David Perlmutter with Kristin Loberg;,POKEMON: ESSENTIAL HANDBOOK;by Cris Silvestri and the staff of Scholastic;,WORKING STIFF;by Judy Melinek and T. J. Mitchell;,LET'S EXPLORE DIABETES WITH OWLS;by David Sedaris;,BAD FEMINIST;by Roxane Gay;,HOW CHILDREN SUCCEED;by Paul Tough;,ONE NATION;by Ben Carson with Candy Carson;,UNPHILTERED;by Phil Robertson with Mark Schlabach;,"THINKING, FAST AND SLOW;by Daniel Kahneman;",UNBREAKABLE RUNNER;by T. J. Murphy and Brian MacKenzie;,THE IRON ROAD;by Christian Wolmar;
6,OUTLANDER;by Diana Gabaldon;10 weeks on the list,THE CHILDREN ACT;by Ian McEwan;4 weeks on the list,SHARP OBJECTS;by Gillian Flynn;25 weeks on the list,,,WHAT IF?;by Randall Munroe;5 weeks on the list,13 HOURS;by Mitchell Zuckoff with members of the Annex Security Team;4 weeks on the list,QUIET;by Susan Cain;87 weeks on the list,AMERICAN SNIPER;by Chris Kyle with Scott McEwen and Jim DeFelice;56 weeks on the list,HOW GOOGLE WORKS;by Eric Schmidt and Jonathan Rosenberg;2 weeks on the list,THE TRUTH IS A CAVE IN THE BLACK MOUNTAINS;by Neil Gaiman and Eddie Campbell;16 weeks on the list,"THE RISE OF AURORA WEST;by Paul Pope, JT Petty and David Rubín;New this week","ATTACK ON TITAN: NO REGRETS, VOL. 1;by Gun Snark, Hikaru Suruga and Hajime Isayama;14 weeks on the list",WONDER;by R.J. Palacio;295 weeks on the list,"ROSIE REVERE, ENGINEER;by Andrea Beaty. Illustrated by David Roberts;30 weeks on the list",PERCY JACKSON & THE OLYMPIANS;by Rick Riordan;347 weeks on the list,STAMPED;by Jason Reynolds and Ibram X. Kendi;59 weeks on the list,UNDERWATER DOGS;by Seth Casteel;,THE ORGANIZED MIND;by Daniel J. Levitin;,WILD TALES;by Graham Nash;,I WEAR THE BLACK HAT;by Chuck Klosterman;,THE MOCKINGBIRD NEXT DOOR;by Marja Mills;,EXCELLENT SHEEP;by William Deresiewicz;,MEN ARE STUPID . . . AND THEY LIKE BIG BOOBS;by Joan Rivers;,ONE POT;by the editors of Martha Stewart Living;,,SLOW DANCING WITH A STRANGER;by Meryl Comer;,COSBY: HIS LIFE AND TIMES;by Mark Whitaker;,LOVE DOES;by Bob Goff;,GO THE -- TO SLEEP;by Adam Mansbach. Illustrated by Ricardo Cortés;,THIS CHANGES EVERYTHING;by Naomi Klein;,WAKING UP;by Sam Harris;,THE POWER OF HABIT;by Charles Duhigg;,THE COMPLETE NINJA;by Masaaki Hatsumi;,THE REPUBLIC OF PIRATES;by Colin Woodard;
7,STEPBROTHER DEAREST;by Penelope Ward;New this week,THE BONE CLOCKS;by David Mitchell;5 weeks on the list,THE TARGET;by David Baldacci;3 weeks on the list,,,THE SENSE OF STYLE;by Steven Pinker;New this week,JESUS ON TRIAL;by David Limbaugh;3 weeks on the list,ORANGE IS THE NEW BLACK;by Piper Kerman;61 weeks on the list,THE HOT ZONE;by Richard Preston;5 weeks on the list,THE CONSCIOUS PARENT;by Shefali Tsabary;7 weeks on the list,"THE GRAVEYARD BOOK, VOL. 1;by Neil Gaiman, P. Craig Russell and others;8 weeks on the list",MARCH: BOOK ONE;by John Lewis and Andrew Aydin. Illustrated by Nate Powell;40 weeks on the list,"ATTACK ON TITAN, VOL. 2;by Hajime Isayama;39 weeks on the list",REFUGEE;by Alan Gratz;129 weeks on the list,OTIS AND THE SCARECROW;by Loren Long;5 weeks on the list,DIARY OF A WIMPY KID;written and illustrated by Jeff Kinney;291 weeks on the list,LORE;by Alexandra Bracken;18 weeks on the list,ELEPHANT COMPANY;by Vicki Constantine Croke;,HOW GOOGLE WORKS;by Eric Schmidt and Jonathan Rosenberg;,PADDLE YOUR OWN CANOE;by Nick Offerman;,JUST MERCY;by Bryan Stevenson;,SO WE READ ON;by Maureen Corrigan;,THE SMARTEST KIDS IN THE WORLD;by Amanda Ripley;,WORN STORIES;by Emily Spivack;,THE GRAIN BRAIN COOKBOOK;by David Perlmutter;,,DR. MUTTER'S MARVELS;by Cristin O'Keefe Aptowicz;,HYPERBOLE AND A HALF;by Allie Brosh;,THE PROMISE;by Rachelle Friedman;,THE WHOLE-BRAIN CHILD;by Daniel J. Siegel and Tina Payne Bryson;,THE ROOSEVELTS;by Geoffrey C. Ward and Ken Burns;,AN INVISIBLE THREAD;by Laura L. Schroff;,THE ORGANIZED MIND;by Daniel J. Levitin;,WHEN THE GAME STANDS TALL;by Neil Hayes;,HUMANS OF NEW YORK;by Brandon Stanton;
8,PERSONAL;by Lee Child;5 weeks on the list,THE LOST KEY;by Catherine Coulter and J. T. Ellison;New this week,OUTLANDER;by Diana Gabaldon;9 weeks on the list,,,13 HOURS;by Mitchell Zuckoff with members of the Annex Security Team;4 weeks on the list,WORLD ORDER;by Henry Kissinger;4 weeks on the list,THE HEART OF EVERYTHING THAT IS;by Bob Drury and Tom Clavin;5 weeks on the list,AN INVISIBLE THREAD;by Laura L. Schroff;17 weeks on the list,WHAT I KNOW FOR SURE;by Oprah Winfrey;5 weeks on the list,"INJUSTICE: GODS AMONG US, VOL. 2;by Tom Taylor, Mike S. Miller, Tom Derenick;10 weeks on the list",EL DEAFO;by Cece Bell;4 weeks on the list,"MONSTER MUSUME, VOL. 4;by Okayado;5 weeks on the list",AMARI AND THE NIGHT BROTHERS;by B.B. Alston;14 weeks on the list,HORTON AND THE KWUGGERBUG AND MORE LOST STORIES;by Dr. Seuss;4 weeks on the list,CAPTAIN UNDERPANTS;written and illustrated by Dav Pilkey;55 weeks on the list,THE ONES WE'RE MEANT TO FIND;by Joan He;New this week,REALLY IMPORTANT STUFF MY DOG HAS TAUGHT ME;by Cynthia L. Copeland;,#GIRLBOSS;by Sophia Amoruso;,TIBETAN PEACH PIE;by Tom Robbins;,FINDING ME;by Michelle Knight with Michelle Burford Weinstein;,TENNESSEE WILLIAMS;by John Lahr;,I AM MALALA;by Malala Yousafzai with Christina Lamb;,VOGUE AND THE METROPOLITAN MUSEUM OF ART COSTUME INSTITUTE;by Hamish Bowles;,WHEAT BELLY TOTAL HEALTH;by Williams Davis;,,THE END OF BACK PAIN;by Patrick Roth;,IS EVERYONE HANGING OUT WITHOUT ME?;by Mindy Kaling;,FIRE SHUT UP IN MY BONES;by Charles M. Blow;,NO-DRAMA DISCIPLINE;by Daniel J. Siegel and Tina Payne Bryson;,RISE OF ISIS;by Jay Sekulow with Jordan Sekulow and others;,HEAVEN IS FOR REAL;by Todd Burpo with Lynn Vincent;,DATACLYSM;by Christian Rudder;,MY CONFERENCE CAN BEAT YOUR CONFERENCE;by Paul Finebaum and Gene Wojciechowski;,BUSHCRAFT 101;by Dave Canterbury;
9,DRAGONFLY IN AMBER;by Diana Gabaldon;6 weeks on the list,THE PAYING GUESTS;by Sarah Waters;3 weeks on the list,FIFTY SHADES OF GREY;by E. L. James;127 weeks on the list,,,WILD;by Cheryl Strayed;81 weeks on the list,THIS CHANGES EVERYTHING;by Naomi Klein;3 weeks on the list,STILL FOOLIN' 'EM;by Billy Crystal;2 weeks on the list,WILD;by Cheryl Strayed;115 weeks on the list,YOU CAN'T MAKE THIS STUFF UP;by Theresa Caputo with Kristina Grish;New this week,FOREVER EVIL;by Geoff Johns and David Finch;4 weeks on the list,"SAGA, VOL. 1;by Brian K. Vaughan and Fiona Staples;76 weeks on the list","SOUL EATER, VOL. 22;by Atsushi Ohkubo;2 weeks on the list",GROUND ZERO;by Alan Gratz;10 weeks on the list,DRAGONS LOVE TACOS;by Adam Rubin. Illustrated by Daniel Salmieri;42 weeks on the list,WHITE RABBIT CHRONICLES;by Gena Showalter;New this week,LEGENDBORN;by Tracy Deonn;9 weeks on the list,INSIDE OF A DOG;by Alexandra Horowitz;,LEAN IN;by Sheryl Sandberg with Nell Scovell;,DARING: MY PASSAGES;by Gail Sheehy;,THE HILLSIDE STRANGLERS;by  Darcy O'Brien;,I WEAR THE BLACK HAT;by Chuck Klosterman;,THINKING IN NUMBERS;by Daniel Tammet;,CHAMPAGNE SUPERNOVAS;by Maureen Callahan;,DANIELLE WALKER'S AGAINST ALL GRAIN: MEALS MADE SIMPLE;by Danielle Walker;,,COCONUT OIL FOR BEGINNERS;by the editors of Rockridge Press;,CAN'T WE TALK ABOUT SOMETHING MORE PLEASANT?;by Roz Chast;,THE NARCISSIST NEXT DOOR;by Jeffrey Kluger;,ALL JOY AND NO FUN;by Jennifer Senior;,AMERICA;by Dinesh D'Souza;,THE WAY OF SERENITY;by Jonathan Morris;,DAVID AND GOLIATH;by Malcolm Gladwell;,THE WISDOM OF FAITH;by Bobby Bowden with Steve Bowden;,UGANDA BE KIDDING ME;by Chelsea Handler;
10,BIG LITTLE LIES;by Liane Moriarty;10 weeks on the list,BIG LITTLE LIES;by Liane Moriarty;9 weeks on the list,THIS IS WHERE I LEAVE YOU;by Jonathan Tropper;10 weeks on the list,,,REBEL YELL;by S. C. Gwynne;New this week,REBEL YELL;by S. C. Gwynne;New this week,BAD FEMINIST;by Roxane Gay;3 weeks on the list,THE SENSE OF STYLE;by Steven Pinker;New this week,THE FIVE LOVE LANGUAGES;by Gary Chapman;78 weeks on the list,"THE WALKING DEAD, BOOK 10;by Robert Kirkman and Charlie Adlard;4 weeks on the list","THE WALKING DEAD, VOL. 21;by Robert Kirkman and Charlie Adlard;6 weeks on the list","SWORD ART ONLINE: AINCRAD, VOL. 2;by Reki Kawahara;2 weeks on the list",WHEN YOU TRAP A TIGER;by Tae Keller;8 weeks on the list,THE PIGEON NEEDS A BATH!;by Mo Willems;23 weeks on the list,I AM NUMBER FOUR;by Pittacus Lore;25 weeks on the list,CHAIN OF IRON;by Cassandra Clare;10 weeks on the list,A WOLF CALLED ROMEO;by Nick Jans;,THINK LIKE A FREAK;by Steven D. Levitt and Stephen J. Dubner;,DEATH PUNCH'D;by Jeremy Spencer;,DEAL WITH THE DEVIL;by Peter Lance;,LIVE FROM NEW YORK;by Tom Shales and James Andrew Miller;,HOW WE LEARN;by Benedict Carey;,HOW TO TIE A SCARF;by the staff of Potter Style;,WHEAT BELLY;by William Davis;,,TOTAL RECOVERY;by Gary Kaplan;,THE GRUMPY GUIDE TO LIFE;by Grumpy Cat staff;,THE LOVE DARE;by Stephen Kendrick and Alex Kendrick with Lawrence Kimbrough;,"GROWING UP DUGGAR;by Jana, Jill, Jessa and Jinger Duggar;",OFF THE SIDELINES;by Kirsten Gillibrand with Elizabeth Weil;,ESCAPE;by Carolyn Jessop;,THE IMMORTAL LIFE OF HENRIETTA LACKS;by Rebecca Skloot;,THE CLOSER;by Mariano Rivera with Wayne Coffey;,CARSICK;by John Waters;
11,THE PERFECT WITNESS;by Iris Johansen;New this week,BONES NEVER LIE;by Kathy Reichs;2 weeks on the list,AMERICANAH;by Chimamanda Ngozi Adichie;,,,JESUS ON TRIAL;by David Limbaugh;3 weeks on the list,A PATH APPEARS;by Nicholas Kristof and Sheryl WuDunn;2 weeks on the list,AMERICAN SNIPER;by Chris Kyle with Scott McEwen and Jim DeFelice;,REBEL YELL;by S. C. Gwynne;,CRAZY IS A COMPLIMENT;by Linda Rottenberg;,,,,,,,,SGT. RECKLESS: AMERICA'S WAR HORSE;by Robin Hutton;,,LIFE;by Keith Richards with James Fox;,UNCERTAIN JUSTICE;by Laurence Tribe and Joshua Matz;,MARK TWAIN: A LIFE;by Ron Powers;,A MIND FOR NUMBERS;by Barbara Oakley;,COCONUT OIL FOR BEGINNERS;by the editors of Rockridge Press;,THE FORKS OVER KNIVES PLAN;by Alona Pulde and Matthew Lederman and others;,,,UGANDA BE KIDDING ME;by Chelsea Handler;,THE ENERGIES OF LOVE;by Donna Eden and David Feinstein;,THE FIVE LOVE LANGUAGES OF CHILDREN;by Gary D. Chapman and Ross Campbell;,,BETWEEN HEAVEN AND GROUND ZERO;by Leslie Haskin;,THE HOT ZONE;by Richard Preston;,THE STORM AND THE TIDE;by Lars Anderson;,"THE BEST AMERICAN TRAVEL WRITING 2013;edited by Elizabeth Gilbert, series editor Jason Wilson;"
12,A GOOD MARRIAGE;by Stephen King;New this week,THE GOLDFINCH;by Donna Tartt;50 weeks on the list,THE ROSIE PROJECT;by Graeme Simsion;,,,AMERICAN SNIPER;by Chris Kyle with Scott McEwen and Jim DeFelice;39 weeks on the list,ONE NATION;by Ben Carson with Candy Carson;20 weeks on the list,"THINKING, FAST AND SLOW;by Daniel Kahneman;",QUIET;by Susan Cain;,THE MYSTERY OF THE SHEMITAH;by Jonathan Cahn;,,,,,,,,A FRIEND LIKE HENRY;by Nuala Gardner;,,JUST KIDS;by Patti Smith;,AFTER SILENCE;by Nancy Venable Raine;,THE HUMAN AGE;by Diane Ackerman;,"EVERYTHING'S AN ARGUMENT;by Andrea A. Lunsford, John J. Ruszkiewicz and Keith Walters;",PRETTY TAKES PRACTICE;by Charla Muller;,AGAINST ALL GRAIN;by Danielle Walker;,,,MY DRUNK KITCHEN;by Hannah Hart;,SLOW DANCING WITH A STRANGER;by Meryl Comer;,I HEART MY LITTLE A-HOLES;by Karen Alpert;,,THE HEART OF EVERYTHING THAT IS;by Bob Drury and Tom Clavin;,THE SMARTEST KIDS IN THE WORLD;by Amanda Ripley;,I NEVER HAD IT MADE;by Jackie W. Robinson;,COCKPIT CONFIDENTIAL;by Patrick Smith;
13,IN YOUR DREAMS;by Kristan Higgins;New this week,THE SECRET PLACE;by Tana French;5 weeks on the list,PRIVATE DOWN UNDER;by James Patterson and Michael White;,,,WORLD ORDER;by Henry Kissinger;4 weeks on the list,THE ROOSEVELTS;by Geoffrey C. Ward and Ken Burns;4 weeks on the list,THE HOT ZONE;by Richard Preston;,FINAL EXAM;by Pauline W. Chen;,THE WAY OF SERENITY;by Jonathan Morris;,,,,,,,,GRUMPY CAT;by Grumpy Cat staff;,,THE CLOSER;by Mariano Rivera with Wayne Coffey;,THE GOOD NURSE;by Charles Graeber;,WHAT WE SEE WHEN WE READ;by Peter Mendelsund;,BUILDING A BETTER TEACHER;by Elizabeth Green;,"PANTONE ON FASHION;by Leatrice Eiseman, E.P. Cutler and Julien Tomasello;",THE MAKE-AHEAD COOK;by editors at America's Test Kitchen;,,,THE SIMPSONS FAMILY HISTORY;by Matt Groening;,TINY BEAUTIFUL THINGS;by Cheryl Strayed;,SUNLIGHT ON MY SHADOW;by  Judy Liautaud;,,THE POWER OF NOW;by Eckhart Tolle;,AN APPETITE FOR WONDER;by Richard Dawkins;,WHAT I TALK ABOUT WHEN I TALK ABOUT RUNNING;by Haruki Murakami;,THE FOREST FEAST;by Erin Gleeson;
14,DARK PLACES;by Gillian Flynn;New this week,A SUDDEN LIGHT;by Garth Stein;New this week,SYCAMORE ROW;by John Grisham;,,,THE HOT ZONE;by Richard Preston;3 weeks on the list,WAKING UP;by Sam Harris;4 weeks on the list,OUTLIERS;by Malcolm Gladwell;,13 HOURS;by Mitchell Zuckoff with members of the Annex Security Team;,10-DAY GREEN SMOOTHIE CLEANSE;by J. J. Smith;,,,,,,,,UNLIKELY LOVES;by Jennifer Holland;,,WORN STORIES;by Emily Spivack;,THE MURDER OF MAGGIE HUME;by Blaine Pardoe and Victoria Hester;,"LOVE, FIERCELY;by Jean Zimmerman;",SO WE READ ON;by Maureen Corrigan;,THE ART OF ASKING;by Amanda Palmer;,A LOVE AFFAIR WITH SOUTHERN COOKING;by Jean Anderson;,,,PEOPLE I WANT TO PUNCH IN THE THROAT;by Jen Mann;,THANKS FOR THE FEEDBACK;by Douglas Stone and Sheila Heen;,FIRE SHUT UP IN MY BONES;by Charles M. Blow;,,KILLING JESUS;by Bill O'Reilly and Martin Dugard;,THINKING IN NUMBERS;by Daniel Tammet;,THE EMERALD MILE;by Kevin Fedarko;,NYC BASIC TIPS AND ETIQUETTE;by Nathan W. Pyle;
15,LOCKE;by Harper Sloan;New this week,STATION ELEVEN;by Emily St. John Mandel;New this week,ME BEFORE YOU;by Jojo Moyes;,,,QUIET;by Susan Cain;38 weeks on the list,THE SHORT AND TRAGIC LIFE OF ROBERT PEACE;by Jeff Hobbs;2 weeks on the list,THE OTHER WES MOORE;by Wes Moore;,THE NAZI OFFICER'S WIFE;by Edith H. Beer with Susan Dworkin;,WHAT TO EXPECT WHEN YOU'RE EXPECTING;by Heidi Murkoff and Sharon Mazel;,,,,,,,,DOG SHAMING;by Pascale Lemire;,,JOHN LENNON;by Philip Norman;,BLOOD ACES;by Doug J. Swanson;,"CREATIVITY, INC;by Ed Catmull with Amy Wallace;",WHAT WE SEE WHEN WE READ;by Peter Mendelsund;,DIOR: THE LEGENDARY IMAGES;by Florence Muller;,TRIM HEALTHY MAMA;by Serene Allison and Pearl P. Barrett;,,,ANGRY OPTIMIST;by Lisa Rogak;,THE EMPATHY EXAMS;by Leslie Jamison;,RARE BIRD;by Anna Whiston-Donaldson;,,ZEALOT;by Reza Aslan;,THE MARSHMALLOW TEST;by Walter Mischel;,AGAINST FOOTBALL: ONE MAN'S RELUCTANT MANIFESTO;by Steve Almond;,FLIRTING WITH FRENCH;by William Alexander;
