,Combined Print & E-Book Fiction,Hardcover Fiction,Paperback Trade Fiction,Paperback Mass-Market Fiction,E-Book Fiction,Combined Print & E-Book Nonfiction,Hardcover Nonfiction,Paperback Nonfiction,E-Book Nonfiction,"Advice, How-To & Miscellaneous",Hardcover Graphic Books,Paperback Graphic Books,Manga,Children’s Middle Grade,Children’s Picture Books,Children’s Series,Young Adult,Animals,Business,Celebrities,Crime and Punishment,Culture,Education,Espionage,Expeditions,"Fashion, Manners and Customs",Food and Diet,Games and Activities,Health,Humor,Indigenous Americans,Love and Relationships,Parenthood and Family,Politics and American History,Race and Civil Rights,"Religion, Spirituality and Faith",Science,Sports and Fitness,Travel
1,THE GIRL ON THE TRAIN;by Paula Hawkins;9 weeks on the list,THE GIRL ON THE TRAIN;by Paula Hawkins;9 weeks on the list,THE HUSBAND'S SECRET;by Liane Moriarty;2 weeks on the list,,,DEAD WAKE;by Erik Larson;New this week,DEAD WAKE;by Erik Larson;New this week,AMERICAN SNIPER;by Chris Kyle with Scott McEwen and Jim DeFelice;71 weeks on the list,DEAD WAKE;by Erik Larson;New this week,THE LIFE-CHANGING MAGIC OF TIDYING UP;by Marie Kondo;20 weeks on the list,CAN'T WE TALK ABOUT SOMETHING MORE PLEASANT?;by Roz Chast;45 weeks on the list,DRAMA;by Raina Telgemeier;85 weeks on the list,"MONSTER MUSUME, VOL. 6;by Okayado;2 weeks on the list",UNCOMFORTABLE CONVERSATIONS WITH A BLACK BOY;by Emmanuel Acho;New this week,THE BOOK WITH NO PICTURES;by B.J. Novak;24 weeks on the list,THE MAZE RUNNER;by James Dashner;127 weeks on the list,REALM BREAKER;by Victoria Aveyard;New this week,H IS FOR HAWK;by Helen Macdonald;,MONEY: MASTER THE GAME;by Tony Robbins;,YES PLEASE;by Amy Poehler;,RED NOTICE;by Bill Browder;,LADY ALMINA AND THE REAL DOWNTON ABBEY;by The Countess of Carnarvon;,I AM MALALA;by Malala Yousafzai with Christina Lamb;,ALAN TURING: THE ENIGMA;by Andrew Hodges;,DEEP DOWN DARK;Héctor Tobar;,"HOW TO BE PARISIAN WHEREVER YOU ARE;by Anne Berest, Audrey Diwan, Caroline de Maigret and Sophie Mas;",THE 20/20 DIET;by Phil McGraw;,MINECRAFT: CONSTRUCTION HANDBOOK;by Matthew Needler and Phil Southam;,GHOST BOY;Martin Pistorius with Megan Lloyd Davies;,YES PLEASE;by Amy Poehler;,THE HEART OF EVERYTHING THAT IS;by Bob Drury and Tom Clavin;,THE FIVE LOVE LANGUAGES;by Gary Chapman;,WHAT TO EXPECT WHEN YOU'RE EXPECTING;by Heidi Murkoff and Sharon Mazel;,AMERICAN SNIPER;by Chris Kyle with Scott McEwen and Jim DeFelice;,GHETTOSIDE;by Jill Leovy;,JESUS CALLING;by Sarah Young;,BEING MORTAL;by Atul Gawande;,UNBROKEN;by Laura Hillenbrand;,WILD;by Cheryl Strayed;
2,ENDANGERED;by C. J. Box;New this week,ALL THE LIGHT WE CANNOT SEE;by Anthony Doerr;45 weeks on the list,FIFTY SHADES DARKER;by E. L. James;108 weeks on the list,,,AMERICAN SNIPER;by Chris Kyle with Scott McEwen and Jim DeFelice;56 weeks on the list,BEING MORTAL;by Atul Gawande;23 weeks on the list,THE BOYS IN THE BOAT;by Daniel James Brown;42 weeks on the list,THE AUTOBIOGRAPHY OF ELEANOR ROOSEVELT;by Eleanor Roosevelt;New this week,"GET WHAT'S YOURS;by Laurence J. Kotlikoff, Philip Moeller and Paul Solman;2 weeks on the list","THE WALKING DEAD, BOOK 11;by Robert Kirkman and Charlie Adlard;New this week",SMILE;by Raina Telgemeier;144 weeks on the list,"NARUTO, VOL. 69;by Masashi Kishimoto;2 weeks on the list",WILLA OF DARK HOLLOW;by Robert Beatty;New this week,THE ADVENTURES OF BEEKLE;by Dan Santat;3 weeks on the list,DIVERGENT;by Veronica Roth;73 weeks on the list,RULE OF WOLVES;by Leigh Bardugo;6 weeks on the list,THE GOOD GOOD PIG;by Sy Montgomery;,BOLD;by Peter H. Diamandis and Steven Kotler;,GIRL IN A BAND;by Kim Gordon;,GHETTOSIDE;by Jill Leovy;,GIRL IN A BAND;by Kim Gordon;,THE TEENAGE BRAIN;by Frances E. Jensen with Amy Ellis Nutt;,RED NOTICE;by Bill Browder;,"DON'T GIVE UP, DON'T GIVE IN;by Louis Zamperini and David Rensin;",THE EVERYDAY SUPERMODEL;by Molly Sims;,10-DAY GREEN SMOOTHIE CLEANSE;by J. J. Smith;,"MINECRAFT: COMBAT HANDBOOK;by Stephanie Milton with Paul Soares, Jr.;",10-DAY GREEN SMOOTHIE CLEANSE;by J. J. Smith;,NOT THAT KIND OF GIRL;by Lena Dunham;,EMPIRE OF THE SUMMER MOON;by S.C. Gwynne;,LEAVING BEFORE THE RAINS COME;by Alexandra Fuller;,LEAVING BEFORE THE RAINS COME;by Alexandra Fuller;,UNBROKEN;by Laura Hillenbrand;,THE NEW JIM CROW;by Michelle Alexander;,THE FOUR AGREEMENTS;by Don Miguel Ruiz;,ALAN TURING: THE ENIGMA;by Andrew Hodges;,THE BOYS IN THE BOAT;by Daniel James Brown;,HUMANS OF NEW YORK;by Brandon Stanton;
3,LAST ONE HOME;by Debbie Macomber;New this week,ENDANGERED;by C. J. Box;New this week,FIFTY SHADES OF GREY;by E. L. James;146 weeks on the list,,,THE BOYS IN THE BOAT;by Daniel James Brown;43 weeks on the list,EVERY DAY I FIGHT;by Stuart Scott with Larry Platt;New this week,UNBROKEN;by Laura Hillenbrand;33 weeks on the list,AMERICAN SNIPER;by Chris Kyle with Scott McEwen and Jim DeFelice;70 weeks on the list,THE FIVE LOVE LANGUAGES;by Gary Chapman;94 weeks on the list,BATMAN: THE KILLING JOKE;by Alan Moore and Brian Bolland;145 weeks on the list,SISTERS;by Raina Telgemeier;30 weeks on the list,"YU-GI-OH! 5D'S, VOL. 7;by Masahiro Hikokubo and Masashi Sato;2 weeks on the list",BECOMING: ADAPTED FOR YOUNG READERS;by Michelle Obama;10 weeks on the list,THE DAY THE CRAYONS QUIT;by Drew Daywalt. Illustrated by Oliver Jeffers;90 weeks on the list,DIARY OF A WIMPY KID;written and illustrated by Jeff Kinney;314 weeks on the list,CONCRETE ROSE;by Angie Thomas;17 weeks on the list,A THREE DOG LIFE;by Abigail Thomas;,RED NOTICE;by Bill Browder;,NOT THAT KIND OF GIRL;by Lena Dunham;,FUTURE CRIMES;by Marc Goodman;,SAPIENS;by Yuval Noah Harari;,HOW CHILDREN SUCCEED;by Paul Tough;,FUTURE CRIMES;by Marc Goodman;,INTO THE WILD;by Jon Krakauer;,HOW TO TIE A SCARF;by the staff of Potter Style;,THUG KITCHEN;by the staff of Thug Kitchen;,MINECRAFT: REDSTONE HANDBOOK;by Nick Farwell. Edited by Jane Riordan and Stephanie Milton;,THE FOOD BABE WAY;by Vani Hari;,BOSSYPANTS;by Tina Fey;,CRAZY HORSE AND CUSTER;by Stephen Ambrose;,SCARY CLOSE;by Donald Miller;,THE OPPOSITE OF SPOILED;by Ron Lieber;,KILLING PATTON;by Bill O'Reilly and Martin Dugard;,MISADVENTURES OF AWKWARD BLACK GIRL;by Issa Rae;,THE POWER OF NOW;by Eckhart Tolle;,WHAT IF?;by Randall Munroe;,H IS FOR HAWK;by Helen Macdonald;,EMPIRE OF MUD;by J.D. Dickey;
4,ALL THE LIGHT WE CANNOT SEE;by Anthony Doerr;26 weeks on the list,A SPOOL OF BLUE THREAD;by Anne Tyler;5 weeks on the list,STILL ALICE;by Lisa Genova;24 weeks on the list,,,WILD;by Cheryl Strayed;104 weeks on the list,KILLING PATTON;by Bill O'Reilly and Martin Dugard;25 weeks on the list,WILD;by Cheryl Strayed;103 weeks on the list,THE BOYS IN THE BOAT;by Daniel James Brown;60 weeks on the list,10-DAY GREEN SMOOTHIE CLEANSE;by J. J. Smith;25 weeks on the list,THE SCULPTOR;by Scott McCloud;6 weeks on the list,MARCH: BOOK ONE;by John Lewis and Andrew Aydin. Illustrated by Nate Powell;46 weeks on the list,"NISEKOI: FALSE LOVE, VOL. 8;by Naoshi Komi;2 weeks on the list",THE ONE AND ONLY BOB;by Katherine Applegate. Illustrated by Patricia Castelao;53 weeks on the list,AQUALICIOUS;by Victoria Kann;2 weeks on the list,BIG NATE;written and illustrated by Lincoln Peirce;98 weeks on the list,FIREKEEPER'S DAUGHTER;by Angeline Boulley;8 weeks on the list,TEAM DOG;by Mike Ritland with Gary Brozek;,THE POWER OF HABIT;by Charles Duhigg;,BOSSYPANTS;by Tina Fey;,AMERICAN GUN;by Chris Kyle with William Doyle;,AS YOU WISH;by Cary Elwes with Joe Layden;,THE SIGNAL AND THE NOISE;by Nate Silver;,GEORGE WASHINGTON'S SECRET SIX;by Brian Kilmeade and Don Yaeger;,ASTORIA;by Peter Stark;,MAKE UP;by Michelle Phan;,THE FOOD BABE WAY;by Vani Hari;,PLAYER'S HANDBOOK;by Wizards RPG Team;,GODDESSES NEVER AGE;by Christiane Northrup;,IS EVERYONE HANGING OUT WITHOUT ME?;by Mindy Kaling;,SHORT NIGHTS OF THE SHADOW CATCHER;by Timothy Egan;,DARING GREATLY;by Brené Brown;,H IS FOR HAWK;by Helen Macdonald;,BELIEVER;by David Axelrod;,CITIZEN;by Claudia Rankine;,THE MYSTERY OF THE SHEMITAH;by Jonathan Cahn;,A BRIEF HISTORY OF TIME;by Stephen Hawking;,ON MY OWN TWO FEET;by Amy Purdy with Michelle Burford;,UGANDA BE KIDDING ME;by Chelsea Handler;
5,A SPOOL OF BLUE THREAD;by Anne Tyler;5 weeks on the list,THE BURIED GIANT;by Kazuo Ishiguro;2 weeks on the list,ORPHAN TRAIN;by Christina Baker Kline;82 weeks on the list,,,UNBROKEN;by Laura Hillenbrand;196 weeks on the list,YES PLEASE;by Amy Poehler;20 weeks on the list,A BRIEF HISTORY OF TIME;by Stephen Hawking;12 weeks on the list,WILD;by Cheryl Strayed;135 weeks on the list,GODDESSES NEVER AGE;by Christiane Northrup;3 weeks on the list,"BONE, NO. 1 (TRIBUTE EDITION);by Jeff Smith;New this week",MARCH: BOOK TWO;by John Lewis and Andrew Aydin. Illustrated by Nate Powell;7 weeks on the list,"JOJO'S BIZARRE ADVENTURES: PHANTOM BLOOD, VOL. 1;by Hirohiko Araki;3 weeks on the list",THE ICKABOG;by J.K. Rowling;26 weeks on the list,DRAGONS LOVE TACOS;by Adam Rubin. Illustrated by Daniel Salmieri;60 weeks on the list,THE SELECTION;by Kiera Cass;31 weeks on the list,ONE OF US IS LYING;by Karen M. McManus;171 weeks on the list,REALLY IMPORTANT STUFF MY DOG HAS TAUGHT ME;by Cynthia L. Copeland;,ZILLOW TALK;by Spencer Rascoff and Stan Humphries;,NIGHT OF THE GUN;by David Carr;,CHASING THE SCREAM;by Johann Hari;,IT'S WHAT I DO;by Lynsey Addario;,THE PROMISE OF A PENCIL;by Adam Braun with Carlye Adler;,JAWBREAKER;by Gary Berntsen and Ralph Pezzullo;,THE SEA WOLVES;by Lars Brownworth;,EMPIRE OF COTTON;by Sven Beckert;,MAKE IT AHEAD!;by Ina Garten;,"MINECRAFT: ESSENTIAL HANDBOOK;Stephanie Milton with Paul Soares, Jr. and Jordan Maron;",AMERICA'S BITTER PILL;by Steven Brill;,AS YOU WISH;by Cary Elwes with Joe Layden;,1491;by Charles C. Mann;,H IS FOR HAWK;by Helen Macdonald;,HOW TO TALK SO KIDS WILL LISTEN AND LISTEN SO KIDS WILL TALK;by Adele Faber and Elaine Mazlish;,LONE SURVIVOR;by Marcus Luttrell with Patrick Robinson;,THE WORK;by Wes Moore;,THE BEST YES;by Lysa TerKeurst;,THE IMMORTAL LIFE OF HENRIETTA LACKS;by Rebecca Skloot;,POWER FORWARD;by Reggie Love;,GONDOLA;by Donna Leon;
6,THE NIGHTINGALE;by Kristin Hannah;6 weeks on the list,LAST ONE HOME;by Debbie Macomber;New this week,FIFTY SHADES FREED;by E. L. James;102 weeks on the list,,,THE AUTOBIOGRAPHY OF ELEANOR ROOSEVELT;by Eleanor Roosevelt;New this week,H IS FOR HAWK;by Helen Macdonald;4 weeks on the list,QUIET;by Susan Cain;101 weeks on the list,UNBROKEN;by Laura Hillenbrand;215 weeks on the list,THUG KITCHEN;by the staff of Thug Kitchen;22 weeks on the list,"SUPERMAN: EARTH ONE, VOL. 3;by J. Michael Straczynski and Ardian Syaf;5 weeks on the list",EL DEAFO;by Cece Bell;19 weeks on the list,"KAMISAMA KISS, VOL. 17;by Julietta Suzuki;2 weeks on the list",WONDER;by R.J. Palacio;295 weeks on the list,PRESS HERE;by Hervé Tullet;183 weeks on the list,I SURVIVED;by Lauren Tarshis;5 weeks on the list,STAMPED;by Jason Reynolds and Ibram X. Kendi;59 weeks on the list,INSIDE OF A DOG;by Alexandra Horowitz;,FUTURE CRIMES;by Marc Goodman;,IS EVERYONE HANGING OUT WITHOUT ME?;by Mindy Kaling;,ORANGE IS THE NEW BLACK;by Piper Kerman;,SAVAGE HARVEST;by Carl Hoffman;,THE SMARTEST KIDS IN THE WORLD;by Amanda Ripley;,OPERATION PAPERCLIP;by Annie Jacobsen;,THE LOST CITY OF Z;by David Grann;,FRENCH WOMEN DON'T GET FACELIFTS;by Mireille Guiliano;,ZERO BELLY DIET;by David Zinczenko;,POKEMON: ESSENTIAL HANDBOOK;by Cris Silvestri and the staff of Scholastic;,THE BRAIN'S WAY OF HEALING;by Norman Doidge;,GO THE -- TO SLEEP;by Adam Mansbach. Illustrated by Ricardo Cortés;,CELLULOID INDIANS;by Jacquelyn Kilpatrick;,LOVE DOES;by Bob Goff;,GO THE -- TO SLEEP;by Adam Mansbach. Illustrated by Ricardo Cortés;,RED NOTICE;by Bill Browder;,THE OTHER WES MOORE;by Wes Moore;,KILLING JESUS;by Bill O'Reilly and Martin Dugard;,THE POWER OF HABIT;by Charles Duhigg;,WRESTLING FOR MY LIFE;by Shawn Michaels with David Thomas;,BUSHCRAFT 101;by Dave Canterbury;
7,FIFTY SHADES DARKER;by E. L. James;62 weeks on the list,THE NIGHTINGALE;by Kristin Hannah;6 weeks on the list,THE MARTIAN;by Andy Weir;20 weeks on the list,,,BEING MORTAL;by Atul Gawande;23 weeks on the list,WHAT IF?;by Randall Munroe;28 weeks on the list,THE POWER OF HABIT;by Charles Duhigg;59 weeks on the list,ANNE FRANK;by Francine Prose;New this week,BOLD;by Peter H. Diamandis and Steven Kotler;4 weeks on the list,SECONDS;by Bryan Lee O'Malley;35 weeks on the list,"SAGA, VOL. 4;by Brian K. Vaughan and Fiona Staples;13 weeks on the list","SERAPH OF THE END, VOL. 4;by Takaya Kagami and Yamato Yamamoto;New this week",REFUGEE;by Alan Gratz;129 weeks on the list,"GOODNIGHT, GOODNIGHT, CONSTRUCTION SITE;by Sherri Duskey Rinker and Tom Lichtenheld;180 weeks on the list",THE HUNGER GAMES;by Suzanne Collins;222 weeks on the list,LORE;by Alexandra Bracken;18 weeks on the list,THE GRUMPY GUIDE TO LIFE;by Grumpy Cat staff;,"THINKING, FAST AND SLOW;by Daniel Kahneman;",TAKING THE LEAD;by Derek Hough;,"GUANTÁNAMO DIARY;by Mohamedou Ould Slahi, edited by Larry Siems;",STEAL LIKE AN ARTIST;by Austin Kleon;,THE LAST LECTURE;by Randy Pausch with Jeffrey Zaslow;,A SPY AMONG FRIENDS;by Ben Macintyre;,ISAAC'S STORM;by Erik Larson;,THE WOMAN I WANTED TO BE;by Diane Von Furstenberg;,IT STARTS WITH FOOD;by Dallas and Melissa Hartwig;,MONSTER MANUAL;by Wizards RPG Team;,SPRING CHICKEN;by Bill Gifford;,CAN'T WE TALK ABOUT SOMETHING MORE PLEASANT?;by Roz Chast;,THE GIRL WHO HELPED THUNDER AND OTHER NATIVE AMERICAN FOLKTALES;adapted by James Bruchac and Joseph Bruchac. Illustrated by Stefano Vitale;,KEEP IT SHUT;by Karen Ehman;,CAN'T WE TALK ABOUT SOMETHING MORE PLEASANT?;by Roz Chast;,GHETTOSIDE;by Jill Leovy;,TWELVE YEARS A SLAVE;by Solomon Northup;,BOUNDARIES;by Henry Cloud and John Townsend;,SAPIENS;by Yuval Noah Harari;,BUSHCRAFT 101;by Dave Canterbury;,ALASKAN TRAVELS;by Edward Hoagland;
8,THE LONGEST RIDE;by Nicholas Sparks;18 weeks on the list,WORLD GONE BY;by Dennis Lehane;New this week,THE ALCHEMIST;by Paulo Coelho;347 weeks on the list,,,EVERY DAY I FIGHT;by Stuart Scott with Larry Platt;New this week,GIRL IN A BAND;by Kim Gordon;3 weeks on the list,THE NEW JIM CROW;by Michelle Alexander;93 weeks on the list,BETTYVILLE;by George Hodgman;New this week,MONEY: MASTER THE GAME;by Tony Robbins;16 weeks on the list,"AVATAR, THE LAST AIRBENDER: THE RIFT LIBRARY EDITION;by Gene Luen Yang and Gurihiru;3 weeks on the list","THE WALKING DEAD COMPENDIUM, VOL. 2;by Robert Kirkman and Charlie Adlard;79 weeks on the list","ATTACK ON TITAN, VOL. 1;by Hajime Isayama;89 weeks on the list",AMARI AND THE NIGHT BROTHERS;by B.B. Alston;14 weeks on the list,WAITING IS NOT EASY!;by Mo Willems;15 weeks on the list,HEROES OF OLYMPUS;by Rick Riordan;96 weeks on the list,THE ONES WE'RE MEANT TO FIND;by Joan He;New this week,"CHASER;by John W. Pilley, Jr. with Hilary Hinzmann;",ZERO TO ONE;by Peter Thiel with Blake Masters;,MISADVENTURES OF AWKWARD BLACK GIRL;by Issa Rae;,LYING IN WAIT;by Ann Rule;,BAD FEMINIST;by Roxane Gay;,THEY SAY / I SAY;by Gerald Graff and Cathy Birkenstein;,WORTHY FIGHTS;by Leon Panetta with Jim Newton;,THE RIVER OF DOUBT;by Candice Millard;,MODELS OF INFLUENCE;by Nigel Barker;,THE SKINNYTASTE COOKBOOK;by Gina Homolka with Heather K. Jones;,MARVEL ENCYCLOPEDIA;by Matt Forbeck;,THE AUTOIMMUNE SOLUTION;by Amy Myers;,MISADVENTURES OF AWKWARD BLACK GIRL;by Issa Rae;,IF YOU POISON US;by Peter H. Eichstaedt with photos by Murrae Haynes;,YOU AND ME FOREVER;by Francis Chan and Lisa Chan;,THE TEENAGE BRAIN;by Frances E. Jensen with Amy Ellis Nutt;,THE REAPER;by Nicholas Irving with Gary Brozek;,GATEWAY TO FREEDOM;by Eric Foner;,THE UNTETHERED SOUL;by Michael A. Singer;,FUTURE CRIMES;by Marc Goodman;,YOU CAN'T MAKE THIS UP;by Al Michaels with L. Jon Wertheim;,"1,000 PLACES TO SEE BEFORE YOU DIE;by Patricia Schultz;"
9,CONFESS;by Colleen Hoover;New this week,THE ASSASSIN;by Clive Cussler and Justin Scott;2 weeks on the list,GONE GIRL;by Gillian Flynn;47 weeks on the list,,,KILLING PATTON;by Bill O'Reilly and Martin Dugard;25 weeks on the list,BETTYVILLE;by George Hodgman;New this week,"THINKING, FAST AND SLOW;by Daniel Kahneman;77 weeks on the list",BEING MORTAL;by Atul Gawande;12 weeks on the list,THE BLOOD SUGAR SOLUTION 10-DAY DETOX DIET COOKBOOK;by Mark Hyman;New this week,HERE;by Richard McGuire;14 weeks on the list,"THE WALKING DEAD COMPENDIUM, VOL. 1;by Robert Kirkman and others;150 weeks on the list",UNOFFICIAL HATSUNE MIX;by KEI;14 weeks on the list,GROUND ZERO;by Alan Gratz;10 weeks on the list,"ROSIE REVERE, ENGINEER;by Andrea Beaty. Illustrated by David Roberts;42 weeks on the list",HARRY POTTER;by J.K. Rowling;317 weeks on the list,LEGENDBORN;by Tracy Deonn;9 weeks on the list,GOOD DOG;by the editors of Garden and Gun Magazine;,OUTLIERS;by Malcolm Gladwell;,THE ANDY COHEN DIARIES;by Andy Cohen;,JUST MERCY;by Bryan Stevenson;,WES ANDERSON COLLECTION: THE GRAND BUDAPEST HOTEL;by Matt Zoller Seitz;,SPARE PARTS;by Joshua Davis;,"LIAR, TEMPTRESS, SOLDIER, SPY;by Karen Abbott;",IN THE KINGDOM OF ICE;by Hampton Sides;,"WOMEN IN CLOTHES;by Sheila Heti, Heidi Julavits, Leanne Shapton & 639 Others;",GRAIN BRAIN;by David Perlmutter with Kristin Loberg;,HACKS FOR MINECRAFTERS;by Megan Miller;,EFFORTLESS HEALING;by Joseph Mercola;,LET'S EXPLORE DIABETES WITH OWLS;by David Sedaris;,BURY MY HEART AT WOUNDED KNEE;by Dee Brown;,MISADVENTURES OF AWKWARD BLACK GIRL;by Issa Rae;,THE GLASS CASTLE;by Jeannette Walls;,ISIS;by Michael Weiss and Hassan Hassan;,DEATH OF A KING;by Tavis Smiley with David Ritz;,PRAYER;by Timothy Keller;,QUIET;by Susan Cain;,JETER UNFILTERED;by Derek Jeter with Anthony Bozza;,TURN RIGHT AT MACHU PICCHU;by Mark Adams;
10,COLD BETRAYAL;by J. A. Jance;New this week,PRODIGAL SON;by Danielle Steel;3 weeks on the list,DARK PLACES;by Gillian Flynn;81 weeks on the list,,,BETTYVILLE;by George Hodgman;New this week,OUR KIDS;by Robert D. Putnam;New this week,10% HAPPIER;by Dan Harris;8 weeks on the list,THE DRESSMAKER OF KHAIR KHANA;by Gayle Tzemach Lemmon;New this week,WHAT TO EXPECT WHEN YOU'RE EXPECTING;by Heidi Murkoff and Sharon Mazel;79 weeks on the list,"THE WALKING DEAD, BOOK 1;by Robert Kirkman, Tony Moore and Charlie Adlard;116 weeks on the list","THE WALKING DEAD, VOL. 22;by Robert Kirkman and Charlie Adlard;14 weeks on the list",WOLF CHILDREN: AME AND YUKI;by Mamoru Hosoda and Yu;10 weeks on the list,WHEN YOU TRAP A TIGER;by Tae Keller;8 weeks on the list,THE PIGEON NEEDS A BATH!;by Mo Willems;40 weeks on the list,PERCY JACKSON & THE OLYMPIANS;by Rick Riordan;356 weeks on the list,CHAIN OF IRON;by Cassandra Clare;10 weeks on the list,UNLIKELY LOVES;by Jennifer Holland;,AMERICA'S BITTER PILL;by Steven Brill;,JIMMY PAGE BY JIMMY PAGE;by Jimmy Page;,THE SHORT AND TRAGIC LIFE OF ROBERT PEACE;by Jeff Hobbs;,LIFE. LOVE. BEAUTY;by Keegan Allen;,MASTERY;by Robert Greene;,DEAR LEADER;by Jang Jin-sung;,THE WILD TRUTH;by Carine McCandless;,WORN STORIES;by Emily Spivack;,THE FAST METABOLISM DIET;by Haylie Pomroy with Eve Adamson;,THE LEGO IDEAS BOOK;by Daniel Lipkowitz;,THE NEW HEALTH RULES;by Frank Lipman and Danielle Claro;,I MUST SAY;by Martin Short with David Kamp;,CODE TALKER;by Chester Nez with Judith Schiess Avila;,BAD FEMINIST;by Roxane Gay;,ALL JOY AND NO FUN;by Jennifer Senior;,I AM MALALA;by Malala Yousafzai with Christina Lamb;,SPARE PARTS;by Joshua Davis;,GOD'S BANKERS;by Gerald Posner;,"THINKING, FAST AND SLOW;by Daniel Kahneman;",ANATOMY OF STRENGTH TRAINING;by Pat Manocchia;,HOW TO TRAVEL THE WORLD ON $50 A DAY;by Matt Kepnes;
11,STILL ALICE;by Lisa Genova;9 weeks on the list,THE FIFTH GOSPEL;by Ian Caldwell;2 weeks on the list,INVISIBLE;by James Patterson and David Ellis;,,,YES PLEASE;by Amy Poehler;20 weeks on the list,DATA AND GOLIATH;by Bruce Schneier;2 weeks on the list,PROOF OF HEAVEN;by Eben Alexander;,THOMAS JEFFERSON;by Henry Moscow;,THE BLOOD SUGAR SOLUTION 10-DAY DETOX DIET;by Mark Hyman;,,,,,,,,I KNEAD MY MOMMY;by Francesco Marciuliano;,,SATURDAY NIGHT LIVE: THE BOOK;edited by Alison Castle;,MANHUNT;by James L. Swanson;,GONDOLA;by Donna Leon;,TEACH LIKE A CHAMPION 2. 0;by Doug Lemov;,THE GOOD SPY;by Kai Bird;,UNTAMED;by Will Harlan;,I SEE YOU MADE AN EFFORT;by Annabelle Gurwitch;,"GOOD CALORIES, BAD CALORIES;by Gary Taubes;",MINECRAFT: BLOCKOPEDIA;by Alex Wiltshire;,,THE ANDY COHEN DIARIES;by Andy Cohen;,,LOVE AND RESPECT;by Emerson Eggerichs;,HOW CHILDREN SUCCEED;by Paul Tough;,,JUST MERCY;by Bryan Stevenson;,PROOF OF HEAVEN;by Eben Alexander;,THE ELEMENTS;by Theodore Gray; photography by Nick Mann;,BLEEDING ORANGE;by Jim Boeheim with Jack McCallum;,A WALK IN THE WOODS;by Bill Bryson;
12,FIFTY SHADES FREED;by E. L. James;59 weeks on the list,MIGHTIER THAN THE SWORD;by Jeffrey Archer;3 weeks on the list,REDEPLOYMENT;by Phil Klay;,,,H IS FOR HAWK;by Helen Macdonald;2 weeks on the list,I AM MALALA;by Malala Yousafzai with Christina Lamb;50 weeks on the list,THE DEVIL IN THE WHITE CITY;by Erik Larson;,H IS FOR HAWK;by Helen Macdonald;,THE GIFTS OF IMPERFECTION;by Brené Brown;,,,,,,,,I COULD PEE ON THIS;by Francesco Marciuliano;,,INDEPENDENT ED;by Edward Burns with Todd Gold;,PRACTICE TO DECEIVE;by Ann Rule;,THE SEA WOLVES;by Lars Brownworth;,ON WRITING;by Stephen King;,THE NAZIS NEXT DOOR;by Eric Lichtblau;,AMELIA;by Nancy Nahra;,ELEMENTS OF STYLE;by Erin Gates;,SUPERFOOD SMOOTHIES;by Julie Morris;,WRECK THIS JOURNAL EVERYWHERE;by Keri Smith;,,OFFICIAL BOOK CLUB SELECTION;by Kathy Griffin;,,ME WITHOUT YOU;by Lisa Swerling Ralph Lazar;,THE WHOLE-BRAIN CHILD;by Daniel J. Siegel and Tina Payne Bryson;,,THE SHORT AND TRAGIC LIFE OF ROBERT PEACE;by Jeff Hobbs;,CRAZY LOVE;by Francis Chan with Danae Yankoski;,SPRING CHICKEN;by Bill Gifford;,THE EMERALD MILE;by Kevin Fedarko;,"HOW TO BE PARISIAN WHEREVER YOU ARE;by Anne Berest, Audrey Diwan, Caroline de Maigret and Sophie Mas;"
13,FIFTY SHADES OF GREY;by E. L. James;81 weeks on the list,COLD BETRAYAL;by J. A. Jance;New this week,THE COLLECTOR;by Nora Roberts;,,,OUR KIDS;by Robert D. Putnam;New this week,NOT THAT KIND OF GIRL;by Lena Dunham;24 weeks on the list,GHOST BOY;Martin Pistorius with Megan Lloyd Davies;,YES PLEASE;by Amy Poehler;,THE MOTIVATION MANIFESTO;by Brendon Burchard;,,,,,,,,UNLIKELY FRIENDSHIPS;by Jennifer Holland;,,JUST KIDS;by Patti Smith;,LOST GIRLS;by Robert Kolker;,PIONEER GIRL;by Laura Ingalls Wilder;,STUFF MATTERS;by Mark Miodownik;,OPERATION SHAKESPEARE;by John Shiffman;,A HOUSE IN THE SKY;by Amanda Lindhout and Sara Corbett;,MADEMOISELLE;by Rhonda K. Garelick;,PRACTICAL PALEO;by Diane Sanfilippo;,THE ULTIMATE MINECRAFT CREATOR;by Triumph Books;,,UGANDA BE KIDDING ME;by Chelsea Handler;,,TINY BEAUTIFUL THINGS;by Cheryl Strayed;,GLITTER AND GLUE;by Kelly Corrigan;,,EYE ON THE STRUGGLE;by James McGrath Morris;,WHAT I KNOW FOR SURE;by Oprah Winfrey;,THE SIXTH EXTINCTION;by Elizabeth Kolbert;,STRONG INSIDE;by Andrew Maraniss;,COCKPIT CONFIDENTIAL;by Patrick Smith;
14,THE HUSBAND'S SECRET;by Liane Moriarty;44 weeks on the list,THE WHITES;by Richard Price writing as Harry Brandt;4 weeks on the list,THE LONGEST RIDE;by Nicholas Sparks;,,,ANNE FRANK;by Francine Prose;New this week,BELIEVER;by David Axelrod;5 weeks on the list,THE IMMORTAL LIFE OF HENRIETTA LACKS;by Rebecca Skloot;,DEAD MOUNTAIN;by Donnie Eichar;,THE 20/20 DIET;by Phil McGraw;,,,,,,,,DOG SONGS;by Mary Oliver;,,PUNK ROCK BLITZKRIEG;by Marky Ramone with Rich Herschlag;,MY BELOVED WORLD;by Sonia Sotomayor;,SILVER SCREEN FIEND;by Patton Oswalt;,MY LIFE IN MIDDLEMARCH;by Rebecca Mead;,GOOD HUNTING;by Jack Devine with Vernon Loeb;,A HISTORY OF THE WORLD IN 12 MAPS;by Jerry Brotton;,SKIN CLEANSE;by Adina Grigore;,DANIELLE WALKER'S AGAINST ALL GRAIN: MEALS MADE SIMPLE;by Danielle Walker;,MINECRAFTER 2. 0 ADVANCED;by Triumph Books;,,SERIOUSLY... I'M KIDDING;by Ellen DeGeneres;,,HOW TO LOVE;by Thich Nhat Hanh. Illustrated by Jason DeAntonis;,LITTLE HEATHENS;by Mildred Armstrong Kalish;,,STRONG INSIDE;by Andrew Maraniss;,SMALL VICTORIES;by Anne Lamott;,THE TEENAGE BRAIN;by Frances E. Jensen with Amy Ellis Nutt;,ORR;by Bobby Orr;,THE ART OF STILLNESS;by Pico Iyer;
15,GONE GIRL;by Gillian Flynn;120 weeks on the list,ALL THE OLD KNIVES;by Olen Steinhauer;New this week,THE ROSIE PROJECT;by Graeme Simsion;,,,THE DEVIL IN THE WHITE CITY;by Erik Larson;6 weeks on the list,17 CARNATIONS;by Andrew Morton;New this week,BOSSYPANTS;by Tina Fey;,EVERY DAY I FIGHT;by Stuart Scott with Larry Platt;,THE FAST METABOLISM DIET;by Haylie Pomroy with Eve Adamson;,,,,,,,,DECODING YOUR DOG;by the staff of the American College of Veterinary Behaviorists;,,BORN TO BE KING;by Catherine Mayer;,EMPIRE OF SIN;by Gary Krist;,LIVE FROM NEW YORK;by Tom Shales and James Andrew Miller;,WHAT WE SEE WHEN WE READ;by Peter Mendelsund;,WASHINGTON'S SPIES;by Alexander Rose;,THE ASTRONAUT WIVES CLUB;by Lily Koppel;,REFINERY29: STYLE STALKING;by Christine Barberich and Piera Gelardi;,THE OH SHE GLOWS COOKBOOK;by Angela Liddon;,THE MONOPOLISTS;by Mary Pilon;,,SILVER SCREEN FIEND;by Patton Oswalt;,,THE ANDY COHEN DIARIES;by Andy Cohen;,THE FIVE LOVE LANGUAGES OF CHILDREN;by Gary D. Chapman and Ross Campbell;,,WARRIORS DON'T CRY;by Melba Pattillo Beals;,"DON'T GIVE UP, DON'T GIVE IN;by Louis Zamperini and David Rensin;",THE SIGNAL AND THE NOISE;by Nate Silver;,BORN TO RUN;by Christopher McDougall;,LOST IN TRANSLATION;by Ella Frances Sanders;
