,Combined Print & E-Book Fiction,Hardcover Fiction,Paperback Trade Fiction,Paperback Mass-Market Fiction,E-Book Fiction,Combined Print & E-Book Nonfiction,Hardcover Nonfiction,Paperback Nonfiction,E-Book Nonfiction,"Advice, How-To & Miscellaneous",Hardcover Graphic Books,Paperback Graphic Books,Manga,Children’s Middle Grade,Children’s Picture Books,Children’s Series,Young Adult,Animals,Business,Celebrities,Crime and Punishment,Culture,Education,Espionage,Expeditions,"Fashion, Manners and Customs",Food and Diet,Games and Activities,Health,Humor,Indigenous Americans,Love and Relationships,Parenthood and Family,Politics and American History,Race and Civil Rights,"Religion, Spirituality and Faith",Science,Sports and Fitness,Travel
1,THE GIRL ON THE TRAIN;by Paula Hawkins;11 weeks on the list,THE GIRL ON THE TRAIN;by Paula Hawkins;11 weeks on the list,THE HUSBAND'S SECRET;by Liane Moriarty;4 weeks on the list,,,BECOMING STEVE JOBS;by Brent Schlender and Rick Tetzeli;New this week,DEAD WAKE;by Erik Larson;3 weeks on the list,AMERICAN SNIPER;by Chris Kyle with Scott McEwen and Jim DeFelice;73 weeks on the list,BECOMING STEVE JOBS;by Brent Schlender and Rick Tetzeli;New this week,THE LIFE-CHANGING MAGIC OF TIDYING UP;by Marie Kondo;22 weeks on the list,CAN'T WE TALK ABOUT SOMETHING MORE PLEASANT?;by Roz Chast;47 weeks on the list,DRAMA;by Raina Telgemeier;87 weeks on the list,"ATTACK ON TITAN, VOL. 15;by Hajime Isayama;2 weeks on the list",UNCOMFORTABLE CONVERSATIONS WITH A BLACK BOY;by Emmanuel Acho;New this week,THE DAY THE CRAYONS QUIT;by Drew Daywalt. Illustrated by Oliver Jeffers;92 weeks on the list,DIVERGENT;by Veronica Roth;75 weeks on the list,REALM BREAKER;by Victoria Aveyard;New this week,H IS FOR HAWK;by Helen Macdonald;,"GET WHAT'S YOURS;by Laurence J. Kotlikoff, Philip Moeller and Paul Solman;",BECOMING STEVE JOBS;by Brent Schlender and Rick Tetzeli;,THE DEVIL IN THE WHITE CITY;by Erik Larson;,PIONEER GIRL;by Laura Ingalls Wilder;,OUR KIDS;by Robert D. Putnam;,RED NOTICE;by Bill Browder;,DEAD WAKE;by Erik Larson;,YOUR BEAUTIFUL HEART;by Lauren Scruggs;,10-DAY GREEN SMOOTHIE CLEANSE;by J. J. Smith;,MINECRAFT: CONSTRUCTION HANDBOOK;by Matthew Needler and Phil Southam;,BEING MORTAL;by Atul Gawande;,YES PLEASE;by Amy Poehler;,THE HEART OF EVERYTHING THAT IS;by Bob Drury and Tom Clavin;,,H IS FOR HAWK;by Helen Macdonald;,AMERICAN SNIPER;by Chris Kyle with Scott McEwen and Jim DeFelice;,THE NEW JIM CROW;by Michelle Alexander;,JESUS CALLING;by Sarah Young;,BEING MORTAL;by Atul Gawande;,THE BOYS IN THE BOAT;by Daniel James Brown;,WILD;by Cheryl Strayed;
2,THE STRANGER;by Harlan Coben;New this week,THE STRANGER;by Harlan Coben;New this week,THE ESCAPE;by David Baldacci;New this week,,,DEAD WAKE;by Erik Larson;3 weeks on the list,BECOMING STEVE JOBS;by Brent Schlender and Rick Tetzeli;New this week,THE BOYS IN THE BOAT;by Daniel James Brown;44 weeks on the list,DEAD WAKE;by Erik Larson;3 weeks on the list,"GET WHAT'S YOURS;by Laurence J. Kotlikoff, Philip Moeller and Paul Solman;4 weeks on the list",BATMAN: THE KILLING JOKE;by Alan Moore and Brian Bolland;147 weeks on the list,SMILE;by Raina Telgemeier;146 weeks on the list,"BIG HERO 6, VOL. 1;by Haruki Ueno;New this week",WILLA OF DARK HOLLOW;by Robert Beatty;New this week,THE BOOK WITH NO PICTURES;by B.J. Novak;26 weeks on the list,THE MAZE RUNNER;by James Dashner;129 weeks on the list,RULE OF WOLVES;by Leigh Bardugo;6 weeks on the list,BENEATH THE SURFACE;by John Hargrove with Howard Chua-Eoan;,BECOMING STEVE JOBS;by Brent Schlender and Rick Tetzeli;,YES PLEASE;by Amy Poehler;,RED NOTICE;by Bill Browder;,SAPIENS;by Yuval Noah Harari;,WHERE YOU GO IS NOT WHO YOU'LL BE;by Frank Bruni;,DATA AND GOLIATH;by Bruce Schneier;,DEAD MOUNTAIN;by Donnie Eichar;,COCONUT OIL FOR BEGINNERS;by the editors of Rockridge Press;,THE 20/20 DIET;by Phil McGraw;,"MINECRAFT: COMBAT HANDBOOK;by Stephanie Milton with Paul Soares, Jr.;",10-DAY GREEN SMOOTHIE CLEANSE;by J. J. Smith;,I HATE MYSELFIE;by Shane Dawson;,EMPIRE OF THE SUMMER MOON;by S.C. Gwynne;,,WHAT TO EXPECT WHEN YOU'RE EXPECTING;by Heidi Murkoff and Sharon Mazel;,UNBROKEN;by Laura Hillenbrand;,MARCH: BOOK ONE;by John Lewis and Andrew Aydin. Illustrated by Nate Powell;,THE FOUR AGREEMENTS;by Don Miguel Ruiz;,A BRIEF HISTORY OF TIME;by Stephen Hawking;,UNBROKEN;by Laura Hillenbrand;,UGANDA BE KIDDING ME;by Chelsea Handler;
3,THE LONGEST RIDE;by Nicholas Sparks;20 weeks on the list,ALL THE LIGHT WE CANNOT SEE;by Anthony Doerr;47 weeks on the list,ORPHAN TRAIN;by Christina Baker Kline;84 weeks on the list,,,AMERICAN SNIPER;by Chris Kyle with Scott McEwen and Jim DeFelice;58 weeks on the list,BEING MORTAL;by Atul Gawande;25 weeks on the list,UNBROKEN;by Laura Hillenbrand;35 weeks on the list,THINK LIKE A FREAK;by Steven D. Levitt and Stephen J. Dubner;9 weeks on the list,THE 20/20 DIET;by Phil McGraw;11 weeks on the list,"THE WALKING DEAD, BOOK 11;by Robert Kirkman and Charlie Adlard;3 weeks on the list",SISTERS;by Raina Telgemeier;32 weeks on the list,"NARUTO, VOL. 69;by Masashi Kishimoto;4 weeks on the list",BECOMING: ADAPTED FOR YOUNG READERS;by Michelle Obama;10 weeks on the list,DRAGONS LOVE TACOS;by Adam Rubin. Illustrated by Daniel Salmieri;62 weeks on the list,DIARY OF A WIMPY KID;written and illustrated by Jeff Kinney;316 weeks on the list,CONCRETE ROSE;by Angie Thomas;17 weeks on the list,WHAT THE DOG KNOWS;by Cat Warren;,MONEY: MASTER THE GAME;by Tony Robbins;,GIRL IN A BAND;by Kim Gordon;,DATA AND GOLIATH;by Bruce Schneier;,IT'S WHAT I DO;by Lynsey Addario;,I AM MALALA;by Malala Yousafzai with Christina Lamb;,FUTURE CRIMES;by Marc Goodman;,ASTORIA;by Peter Stark;,EVERYTHING EYES;by Bobbi Brown;,THUG KITCHEN;by the staff of Thug Kitchen;,"MINECRAFT: ESSENTIAL HANDBOOK;Stephanie Milton with Paul Soares, Jr. and Jordan Maron;",GODDESSES NEVER AGE;by Christiane Northrup;,NOT THAT KIND OF GIRL;by Lena Dunham;,SHORT NIGHTS OF THE SHADOW CATCHER;by Timothy Egan;,,BETTYVILLE;by George Hodgman;,KILLING PATTON;by Bill O'Reilly and Martin Dugard;,SAME KIND OF DIFFERENT AS ME;by Ron Hall and Denver Moore with Lynn Vincent;,KILLING JESUS;by Bill O'Reilly and Martin Dugard;,WHAT IF?;by Randall Munroe;,H IS FOR HAWK;by Helen Macdonald;,BENEATH THE SURFACE;by John Hargrove with Howard Chua-Eoan;
4,NYPD RED 3;by James Patterson and Marshall Karp;2 weeks on the list,NYPD RED 3;by James Patterson and Marshall Karp;2 weeks on the list,THE MARTIAN;by Andy Weir;22 weeks on the list,,,THE BOYS IN THE BOAT;by Daniel James Brown;45 weeks on the list,PIONEER GIRL;by Laura Ingalls Wilder;3 weeks on the list,WILD;by Cheryl Strayed;105 weeks on the list,THE SIX WIVES OF HENRY VIII;by Alison Weir;New this week,BETTER THAN BEFORE;by Gretchen Rubin;2 weeks on the list,THE SCULPTOR;by Scott McCloud;8 weeks on the list,EL DEAFO;by Cece Bell;21 weeks on the list,"MONSTER MUSUME, VOL. 6;by Okayado;4 weeks on the list",THE ONE AND ONLY BOB;by Katherine Applegate. Illustrated by Patricia Castelao;53 weeks on the list,THE ADVENTURES OF BEEKLE;by Dan Santat;5 weeks on the list,BIG NATE;written and illustrated by Lincoln Peirce;100 weeks on the list,FIREKEEPER'S DAUGHTER;by Angeline Boulley;8 weeks on the list,TUNA MELTS MY HEART;by Courtney Dasher;,BOLD;by Peter H. Diamandis and Steven Kotler;,I HATE MYSELFIE;by Shane Dawson;,FUTURE CRIMES;by Marc Goodman;,STEAL LIKE AN ARTIST;by Austin Kleon;,FOCUS;by Daniel Goleman;,ALAN TURING: THE ENIGMA;by Andrew Hodges;,INTO THE WILD;by Jon Krakauer;,TIM GUNN:  THE NATTY PROFESSOR;by Tim Gunn with Ada Calhoun;,THE FAST METABOLISM DIET;by Haylie Pomroy with Eve Adamson;,MINECRAFT: REDSTONE HANDBOOK;by Nick Farwell. Edited by Jane Riordan and Stephanie Milton;,THE FOOD BABE WAY;by Vani Hari;,BOSSYPANTS;by Tina Fey;,1491;by Charles C. Mann;,,HOW TO TALK SO KIDS WILL LISTEN AND LISTEN SO KIDS WILL TALK;by Adele Faber and Elaine Mazlish;,LONE SURVIVOR;by Marcus Luttrell with Patrick Robinson;,MARCH: BOOK TWO;by John Lewis and Andrew Aydin. Illustrated by Nate Powell;,THE POWER OF NOW;by Eckhart Tolle;,QUIET;by Susan Cain;,EVERY DAY I FIGHT;by Stuart Scott with Larry Platt;,HUMANS OF NEW YORK;by Brandon Stanton;
5,ALL THE LIGHT WE CANNOT SEE;by Anthony Doerr;28 weeks on the list,A SPOOL OF BLUE THREAD;by Anne Tyler;7 weeks on the list,THE LONGEST RIDE;by Nicholas Sparks;13 weeks on the list,,,UNBROKEN;by Laura Hillenbrand;198 weeks on the list,H IS FOR HAWK;by Helen Macdonald;6 weeks on the list,"THINKING, FAST AND SLOW;by Daniel Kahneman;78 weeks on the list",THE BOYS IN THE BOAT;by Daniel James Brown;62 weeks on the list,10-DAY GREEN SMOOTHIE CLEANSE;by J. J. Smith;27 weeks on the list,"BONE, NO. 1 (TRIBUTE EDITION);by Jeff Smith;3 weeks on the list","THE WALKING DEAD COMPENDIUM, VOL. 1;by Robert Kirkman and others;152 weeks on the list",SOUL EATER VOL. 25;by Atsushi Ohkubo;New this week,THE ICKABOG;by J.K. Rowling;26 weeks on the list,AQUALICIOUS;by Victoria Kann;4 weeks on the list,THE SELECTION;by Kiera Cass;33 weeks on the list,ONE OF US IS LYING;by Karen M. McManus;171 weeks on the list,A WOLF CALLED ROMEO;by Nick Jans;,THINK LIKE A FREAK;by Steven D. Levitt and Stephen J. Dubner;,NOT THAT KIND OF GIRL;by Lena Dunham;,ORANGE IS THE NEW BLACK;by Piper Kerman;,ANNE FRANK;by Francine Prose;,LETTERS OF NOTE;compiled by Shaun Usher;,GEORGE WASHINGTON'S SECRET SIX;by Brian Kilmeade and Don Yaeger;,ISAAC'S STORM;by Erik Larson;,NICKY HASLAM: A DESIGNER'S LIFE;by Nicky Haslam;,THE BLOOD SUGAR SOLUTION 10-DAY DETOX DIET COOKBOOK;by Mark Hyman;,PLAYER'S HANDBOOK;by Wizards RPG Team;,THE BLOOD SUGAR SOLUTION 10-DAY DETOX DIET;by Mark Hyman;,LIVE RIGHT AND FIND HAPPINESS (ALTHOUGH BEER IS MUCH FASTER);by Dave Barry;,CODE TALKER;by Chester Nez with Judith Schiess Avila;,,THE OPPOSITE OF SPOILED;by Ron Lieber;,OUR KIDS;by Robert D. Putnam;,CITIZEN;by Claudia Rankine;,HERETIC;by Ayaan Hirsi Ali;,THE POWER OF HABIT;by Charles Duhigg;,THE SPORTS GENE;by David Epstein;,AROUND THE WORLD IN 50 YEARS;by Albert Podell;
6,THE NIGHTINGALE;by Kristin Hannah;8 weeks on the list,THE NIGHTINGALE;by Kristin Hannah;8 weeks on the list,THE BURNING ROOM;by Michael Connelly;2 weeks on the list,,,WILD;by Cheryl Strayed;106 weeks on the list,WHERE YOU GO IS NOT WHO YOU'LL BE;by Frank Bruni;2 weeks on the list,THE POWER OF HABIT;by Charles Duhigg;61 weeks on the list,AMERICAN SNIPER;by Chris Kyle with Scott McEwen and Jim DeFelice;72 weeks on the list,THE FIVE LOVE LANGUAGES;by Gary Chapman;96 weeks on the list,SECONDS;by Bryan Lee O'Malley;37 weeks on the list,"THE WALKING DEAD, VOL. 22;by Robert Kirkman and Charlie Adlard;16 weeks on the list","SWORD ART ONLINE: FAIRY DANCE, VOL. 3;by Reki Kawahara and Tsubasa Haduki;New this week",WONDER;by R.J. Palacio;295 weeks on the list,PRESS HERE;by Hervé Tullet;185 weeks on the list,I SURVIVED;by Lauren Tarshis;7 weeks on the list,STAMPED;by Jason Reynolds and Ibram X. Kendi;59 weeks on the list,THE THING WITH FEATHERS;by Noah Strycker;,THE POWER OF HABIT;by Charles Duhigg;,BOSSYPANTS;by Tina Fey;,GHETTOSIDE;by Jill Leovy;,JUST KIDS FROM THE BRONX;by Arlene Alda;,THE SIGNAL AND THE NOISE;by Nate Silver;,GET THE TRUTH;by Philip Houston and Michael Floyd;,WHAT STANDS IN A STORM;by Kim Cross;,THE BERGDORF GOODMAN COOKBOOK;by Laura Silverman and Bergdorf Goodman Staff;,THE FOOD BABE WAY;by Vani Hari;,POKEMON: ESSENTIAL HANDBOOK;by Cris Silvestri and the staff of Scholastic;,AGING BACKWARDS;by Miranda Esmonde-White;,GO THE -- TO SLEEP;by Adam Mansbach. Illustrated by Ricardo Cortés;,GIVEAWAYS;by Linda Boyden;,,GO THE -- TO SLEEP;by Adam Mansbach. Illustrated by Ricardo Cortés;,THE NEW JIM CROW;by Michelle Alexander;,GHETTOSIDE;by Jill Leovy;,GOING CLEAR;by Lawrence Wright;,"THINKING, FAST AND SLOW;by Daniel Kahneman;",JETER UNFILTERED;by Derek Jeter with Anthony Bozza;,TURN RIGHT AT MACHU PICCHU;by Mark Adams;
7,A SPOOL OF BLUE THREAD;by Anne Tyler;7 weeks on the list,THE BURIED GIANT;by Kazuo Ishiguro;4 weeks on the list,STILL ALICE;by Lisa Genova;26 weeks on the list,,,THINK LIKE A FREAK;by Steven D. Levitt and Stephen J. Dubner;9 weeks on the list,KILLING PATTON;by Bill O'Reilly and Martin Dugard;27 weeks on the list,THRIVE;by Arianna Huffington;2 weeks on the list,WILD;by Cheryl Strayed;137 weeks on the list,THUG KITCHEN;by the staff of Thug Kitchen;23 weeks on the list,HERE;by Richard McGuire;16 weeks on the list,"THE WALKING DEAD COMPENDIUM, VOL. 2;by Robert Kirkman and Charlie Adlard;81 weeks on the list","ALL YOU NEED IS KILL;by Hiroshi Sakurazaka, Ryosuke Takeuchi and Takeshi Obata;4 weeks on the list",REFUGEE;by Alan Gratz;129 weeks on the list,"GOODNIGHT, GOODNIGHT, CONSTRUCTION SITE;by Sherri Duskey Rinker and Tom Lichtenheld;182 weeks on the list",HARRY POTTER;by J.K. Rowling;319 weeks on the list,LORE;by Alexandra Bracken;18 weeks on the list,INSIDE OF A DOG;by Alexandra Horowitz;,THRIVE;by Arianna Huffington;,IS EVERYONE HANGING OUT WITHOUT ME?;by Mindy Kaling;,JUST MERCY;by Bryan Stevenson;,BAD FEMINIST;by Roxane Gay;,THE END OF COLLEGE;by Kevin Carey;,AGENT GARBO;by Stephan Talty;,AROUND THE WORLD IN 50 YEARS;by Albert Podell;,"HOW TO BE PARISIAN WHEREVER YOU ARE;by Anne Berest, Audrey Diwan, Caroline de Maigret and Sophie Mas;",ZERO BELLY DIET;by David Zinczenko;,MONSTER MANUAL;by Wizards RPG Team;,GHOST BOY;Martin Pistorius with Megan Lloyd Davies;,IS EVERYONE HANGING OUT WITHOUT ME?;by Mindy Kaling;,NATION TO NATION;edited by Suzan Shown Harjo;,,CAN'T WE TALK ABOUT SOMETHING MORE PLEASANT?;by Roz Chast;,RED NOTICE;by Bill Browder;,JUST MERCY;by Bryan Stevenson;,PROOF OF HEAVEN;by Eben Alexander;,THE IMMORTAL LIFE OF HENRIETTA LACKS;by Rebecca Skloot;,A WRESTLING LIFE;by Dan Gable and Scott Schulte;,MEET ME IN ATLANTIS;by Mark Adams;
8,THE HUSBAND'S SECRET;by Liane Moriarty;46 weeks on the list,CUBA STRAITS;by Randy Wayne White;New this week,GONE GIRL;by Gillian Flynn;49 weeks on the list,,,THE SIX WIVES OF HENRY VIII;by Alison Weir;New this week,HERETIC;by Ayaan Hirsi Ali;New this week,QUIET;by Susan Cain;103 weeks on the list,UNBROKEN;by Laura Hillenbrand;217 weeks on the list,ZERO BELLY DIET;by David Zinczenko;5 weeks on the list,"THE WALKING DEAD, BOOK 1;by Robert Kirkman, Tony Moore and Charlie Adlard;117 weeks on the list",ROLLER GIRL;by Victoria Jamieson;New this week,"ATTACK ON TITAN, VOL. 1;by Hajime Isayama;91 weeks on the list",AMARI AND THE NIGHT BROTHERS;by B.B. Alston;14 weeks on the list,WAITING IS NOT EASY!;by Mo Willems;17 weeks on the list,THE PENDERWICKS;by Jeanne Birdsall;2 weeks on the list,THE ONES WE'RE MEANT TO FIND;by Joan He;New this week,UNLIKELY FRIENDSHIPS;by Jennifer Holland;,OUR KIDS;by Robert D. Putnam;,HOW TO BE A WOMAN;by Caitlin Moran;,AMERICAN GUN;by Chris Kyle with William Doyle;,LETTERS OF NOTE;compiled by Shaun Usher;,THE PROMISE OF A PENCIL;by Adam Braun with Carlye Adler;,SEE NO EVIL;by Robert Baer;,IN THE HEART OF THE SEA;by Nathaniel Philbrick;,MODELS OF INFLUENCE;by Nigel Barker;,THE BLOOD SUGAR SOLUTION 10-DAY DETOX DIET;by Mark Hyman;,THE LEGO IDEAS BOOK;by Daniel Lipkowitz;,EFFORTLESS HEALING;by Joseph Mercola;,ASAPSCIENCE;by Mitchell Moffit;,BURY MY HEART AT WOUNDED KNEE;by Dee Brown;,,THE MAN WHO LEFT;by Theresa Weir;,HERETIC;by Ayaan Hirsi Ali;,TWELVE YEARS A SLAVE;by Solomon Northup;,BOUNDARIES;by Henry Cloud and John Townsend;,SAPIENS;by Yuval Noah Harari;,WRESTLING FOR MY LIFE;by Shawn Michaels with David Thomas;,THE HOTEL ON PLACE VENDOME;by Tilar J. Mazzeo;
9,SHOPPING FOR A BILLIONAIRE;by Julia Kent;New this week,ENDANGERED;by C. J. Box;3 weeks on the list,FIFTY SHADES DARKER;by E. L. James;110 weeks on the list,,,BEING MORTAL;by Atul Gawande;25 weeks on the list,YES PLEASE;by Amy Poehler;22 weeks on the list,FLASH BOYS;by Michael Lewis;New this week,THE UPSIDE OF IRRATIONALITY;by Dan Ariely;New this week,YOGA GIRL;by Rachel Brathen;New this week,AVENGERS AND X-MEN: AXIS;by Rick Remender and others;2 weeks on the list,MARCH: BOOK TWO;by John Lewis and Andrew Aydin. Illustrated by Nate Powell;9 weeks on the list,"SERAPH OF THE END, VOL. 4;by Takaya Kagami and Yamato Yamamoto;3 weeks on the list",GROUND ZERO;by Alan Gratz;10 weeks on the list,"ROSIE REVERE, ENGINEER;by Andrea Beaty. Illustrated by David Roberts;43 weeks on the list",THE HUNGER GAMES;by Suzanne Collins;224 weeks on the list,LEGENDBORN;by Tracy Deonn;9 weeks on the list,THE GRUMPY GUIDE TO LIFE;by Grumpy Cat staff;,"THINKING, FAST AND SLOW;by Daniel Kahneman;",JUST KIDS FROM THE BRONX;by Arlene Alda;,LYING IN WAIT;by Ann Rule;,LEONARDO DA VINCI;by  Jay Williams;,HOW CHILDREN SUCCEED;by Paul Tough;,"LIAR, TEMPTRESS, SOLDIER, SPY;by Karen Abbott;",SAVAGE HARVEST;by Carl Hoffman;,I SEE YOU MADE AN EFFORT;by Annabelle Gurwitch;,IT STARTS WITH FOOD;by Dallas and Melissa Hartwig;,"THE LEGEND OF ZELDA, HYRULE HISTORIA;by Patrick Thorpe and Michael Gombos, et al.;",SPRING CHICKEN;by Bill Gifford;,CAN'T WE TALK ABOUT SOMETHING MORE PLEASANT?;by Roz Chast;,AN INFINITY OF NATIONS;by Michael Witgen;,,THE WHOLE-BRAIN CHILD;by Daniel J. Siegel and Tina Payne Bryson;,DATA AND GOLIATH;by Bruce Schneier;,THE OTHER WES MOORE;by Wes Moore;,THE UNTETHERED SOUL;by Michael A. Singer;,WHAT THE DOG KNOWS;by Cat Warren;,PLAYERS FIRST;by John Calipari and Michael Sokolove;,COCKPIT CONFIDENTIAL;by Patrick Smith;
10,GONE GIRL;by Gillian Flynn;122 weeks on the list,A DANGEROUS PLACE;by Jacqueline Winspear;2 weeks on the list,RUBY;by Cynthia Bond;4 weeks on the list,,,PIONEER GIRL;by Laura Ingalls Wilder;3 weeks on the list,EVERY DAY I FIGHT;by Stuart Scott with Larry Platt;3 weeks on the list,WE SHOULD ALL BE FEMINISTS;by Chimamanda Ngozi Adichie;New this week,BEING MORTAL;by Atul Gawande;14 weeks on the list,THE COMPLETE VEGETARIAN COOKBOOK;by the staff of America's Test Kitchen;New this week,"NATHAN HALE'S HAZARDOUS TALES: TREATIES, TRENCHES, MUD, AND BLOOD;by Nathan Hale;13 weeks on the list","LOW, VOL. 1;by Rick Remender and Greg Tocchini;New this week","ASSASSINATION CLASSROOM, VOL. 2;by Yusei Matsui;5 weeks on the list",WHEN YOU TRAP A TIGER;by Tae Keller;8 weeks on the list,THE PIGEON NEEDS A BATH!;by Mo Willems;41 weeks on the list,DORK DIARIES;by Rachel Renée Russell;124 weeks on the list,CHAIN OF IRON;by Cassandra Clare;10 weeks on the list,REALLY IMPORTANT STUFF MY DOG HAS TAUGHT ME;by Cynthia L. Copeland;,BETTER AND FASTER;by Jeremy Gutsche;,NIGHT OF THE GUN;by David Carr;,FINDING ME;by Michelle Knight with Michelle Burford Weinstein;,THE PEABODY SISTERS;by Megan Marshall;,THE SMARTEST KIDS IN THE WORLD;by Amanda Ripley;,OPERATION PAPERCLIP;by Annie Jacobsen;,DEEP DOWN DARK;Héctor Tobar;,HOW TO TIE A SCARF;by the staff of Potter Style;,THE COMPLETE VEGETARIAN COOKBOOK;by the staff of America's Test Kitchen;,MINECRAFT: BLOCKOPEDIA;by Alex Wiltshire;,MOODY BITCHES;by Julie Holland;,HOW TO BE A WOMAN;by Caitlin Moran;,LAKOTA WOMAN;by Mary Crow Dog and Richard Erdoes;,,OVERWHELMED;by Brigid Schulte;,I AM MALALA;by Malala Yousafzai with Christina Lamb;,MISADVENTURES OF AWKWARD BLACK GIRL;by Issa Rae;,GOD'S BANKERS;by Gerald Posner;,ASAPSCIENCE;by Mitchell Moffit;,KOOK;by Peter Heller;,"1,000 PLACES TO SEE BEFORE YOU DIE;by Patricia Schultz;"
11,THE ESCAPE;by David Baldacci;12 weeks on the list,THE FIFTH GOSPEL;by Ian Caldwell;4 weeks on the list,FIFTY SHADES FREED;by E. L. James;,,,H IS FOR HAWK;by Helen Macdonald;4 weeks on the list,WHAT IF?;by Randall Munroe;30 weeks on the list,10% HAPPIER;by Dan Harris;,YES PLEASE;by Amy Poehler;,WHAT TO EXPECT WHEN YOU'RE EXPECTING;by Heidi Murkoff and Sharon Mazel;,,,,,,,,A STREET CAT NAMED BOB;by James Bowen;,,THE ANDY COHEN DIARIES;by Andy Cohen;,TINSELTOWN;by William J. Mann;,MASTER THIEVES;by Stephen Kurkjian;,THE LAST LECTURE;by Randy Pausch with Jeffrey Zaslow;,A SPY AMONG FRIENDS;by Ben Macintyre;,THE RIVER OF DOUBT;by Candice Millard;,MAKE UP;by Michelle Phan;,GRAIN BRAIN;by David Perlmutter with Kristin Loberg;,HACKS FOR MINECRAFTERS;by Megan Miller;,,UGANDA BE KIDDING ME;by Chelsea Handler;,,,THE GLASS CASTLE;by Jeannette Walls;,,THE SHORT AND TRAGIC LIFE OF ROBERT PEACE;by Jeff Hobbs;,THE BEST YES;by Lysa TerKeurst;,BENEATH THE SURFACE;by John Hargrove with Howard Chua-Eoan;,YOU CAN'T MAKE THIS UP;by Al Michaels with L. Jon Wertheim;,TRACKS;by Robyn Davidson;
12,A WICKED SNOW;by Gregg Olsen;New this week,LEAVING BERLIN;by Joseph Kanon;2 weeks on the list,WHAT ALICE FORGOT;by Liane Moriarty;,,,KILLING PATTON;by Bill O'Reilly and Martin Dugard;27 weeks on the list,OUR KIDS;by Robert D. Putnam;3 weeks on the list,I HATE MYSELFIE;by Shane Dawson;,HERETIC;by Ayaan Hirsi Ali;,MONEY: MASTER THE GAME;by Tony Robbins;,,,,,,,,DOG SONGS;by Mary Oliver;,,JUST KIDS;by Patti Smith;,MASTER THIEVES;by Stephen Kurkjian;,THE FUTURE OF ARCHITECTURE IN 100 BUILDINGS;by Marc Kushner;,"HEALING ADD, REVISED EDITION;by Daniel G. Amen;",WORTHY FIGHTS;by Leon Panetta with Jim Newton;,UNTAMED;by Will Harlan;,THE EVERYDAY SUPERMODEL;by Molly Sims;,THE SKINNYTASTE COOKBOOK;by Gina Homolka with Heather K. Jones;,WRECK THIS JOURNAL EVERYWHERE;by Keri Smith;,,EXPLORING CALVIN AND HOBBES;by Bill Watterson and Robb Jenny;,,,GLITTER AND GLUE;by Kelly Corrigan;,,GATEWAY TO FREEDOM;by Eric Foner;,FOUR BLOOD MOONS;by John Hagee;,ANATOMY OF AN EPIDEMIC;by Robert Whitaker;,WHERE NOBODY KNOWS YOUR NAME;by John Feinstein;,UNTAMED;by Will Harlan;
13,STILL ALICE;by Lisa Genova;11 weeks on the list,WORLD GONE BY;by Dennis Lehane;3 weeks on the list,THE ALCHEMIST;by Paulo Coelho;,,,HERETIC;by Ayaan Hirsi Ali;New this week,KILLING JESUS;by Bill O'Reilly and Martin Dugard;40 weeks on the list,THE NEW JIM CROW;by Michelle Alexander;,OBAMA: FROM PROMISE TO POWER;by David Mendell;,THE MOTIVATION MANIFESTO;by Brendon Burchard;,,,,,,,,ELEPHANT COMPANY;by Vicki Constantine Croke;,,JETER UNFILTERED;by Derek Jeter with Anthony Bozza;,THE WILDERNESS OF RUIN;by Roseanne Montillo;,WES ANDERSON COLLECTION: THE GRAND BUDAPEST HOTEL;by Matt Zoller Seitz;,THE TEENAGE BRAIN;by Frances E. Jensen with Amy Ellis Nutt;,THE NAZIS NEXT DOOR;by Eric Lichtblau;,"DON'T GIVE UP, DON'T GIVE IN;by Louis Zamperini and David Rensin;",THE BATTLE OF VERSAILLES;by Robin Givhan;,WHEAT BELLY;by William Davis;,THE ULTIMATE MINECRAFT CREATOR;by Triumph Books;,,LET'S EXPLORE DIABETES WITH OWLS;by David Sedaris;,,,LEAVING BEFORE THE RAINS COME;by Alexandra Fuller;,,THE WORK;by Wes Moore;,THE MYSTERY OF THE SHEMITAH;by Jonathan Cahn;,SPRING CHICKEN;by Bill Gifford;,THE EMERALD MILE;by Kevin Fedarko;,KOOK;by Peter Heller;
14,CUBA STRAITS;by Randy Wayne White;New this week,THE ASSASSIN;by Clive Cussler and Justin Scott;4 weeks on the list,FIFTY SHADES OF GREY;by E. L. James;,,,YES PLEASE;by Amy Poehler;22 weeks on the list,BETTYVILLE;by George Hodgman;3 weeks on the list,THE DEVIL IN THE WHITE CITY;by Erik Larson;,FOCUS;by Daniel Goleman;,THE MEDITERRANEAN DIET FOR EVERY DAY;by the staff of Telamon Press;,,,,,,,,UNLIKELY LOVES;by Jennifer Holland;,,I LEFT IT ON THE MOUNTAIN;by Kevin Sessums;,WICKED TAKES THE WITNESS STAND;by Mardi Link;,SAVAGE HARVEST;by Carl Hoffman;,TEACH LIKE A CHAMPION 2. 0;by Doug Lemov;,THE INFORMANT;by Kurt Eichenwald;,ONE MORE STEP;by Bonner Paddock with Neal Bascomb;,"WOMEN IN CLOTHES;by Sheila Heti, Heidi Julavits, Leanne Shapton & 639 Others;",DELICIOUSLY ELLA;by Ella Woodward;,MINECRAFTER 2. 0 ADVANCED;by Triumph Books;,,THE ANDY COHEN DIARIES;by Andy Cohen;,,,HOW CHILDREN SUCCEED;by Paul Tough;,,THE SECRET GAME;by Scott Ellsworth;,PRAYER;by Timothy Keller;,FUTURE CRIMES;by Marc Goodman;,THE SECRET GAME;by Scott Ellsworth;,HOW TO TRAVEL THE WORLD ON $50 A DAY;by Matt Kepnes;
15,MANWHORE;by Katy Evans;New this week,LAST ONE HOME;by Debbie Macomber;3 weeks on the list,EUPHORIA;by Lily King;,,,THE UPSIDE OF IRRATIONALITY;by Dan Ariely;New this week,GOD'S BANKERS;by Gerald Posner;2 weeks on the list,OUTLIERS;by Malcolm Gladwell;,WHAT COMES NEXT AND HOW TO LIKE IT;by Abigail Thomas;,THE FAST METABOLISM DIET;by Haylie Pomroy with Eve Adamson;,,,,,,,,SEABISCUIT;by Laura Hillenbrand;,,JERRY LEE LEWIS;by Rick Bragg;,CHASING THE SCREAM;by Johann Hari;,AS YOU WISH;by Cary Elwes with Joe Layden;,ON WRITING;by Stephen King;,DEAR LEADER;by Jang Jin-sung;,IN THE KINGDOM OF ICE;by Hampton Sides;,THE WOMAN I WANTED TO BE;by Diane Von Furstenberg;,WHEAT BELLY 30-MINUTE (OR LESS!) COOKBOOK;by William Davis;,1000 DOT-TO-DOT: CITIES;by Thomas Pavitte;,,HYPERBOLE AND A HALF;by Allie Brosh;,,,THIS IS THE STORY OF A HAPPY MARRIAGE;by Ann Patchett;,,EMPIRE OF COTTON;by Sven Beckert;,HEAVEN IS FOR REAL;by Todd Burpo with Lynn Vincent;,ALAN TURING: THE ENIGMA;by Andrew Hodges;,ON MY OWN TWO FEET;by Amy Purdy with Michelle Burford;,"HOW TO BE PARISIAN WHEREVER YOU ARE;by Anne Berest, Audrey Diwan, Caroline de Maigret and Sophie Mas;"
