,Combined Print & E-Book Fiction,Hardcover Fiction,Paperback Trade Fiction,Paperback Mass-Market Fiction,E-Book Fiction,Combined Print & E-Book Nonfiction,Hardcover Nonfiction,Paperback Nonfiction,E-Book Nonfiction,"Advice, How-To & Miscellaneous",Hardcover Graphic Books,Paperback Graphic Books,Manga,Children’s Middle Grade E-Book,Children’s Middle Grade Hardcover,Children’s Middle Grade Paperback,Children’s Picture Books,Children’s Series,Young Adult E-Book,Young Adult Hardcover,Young Adult Paperback,Animals,Business,Celebrities,Crime and Punishment,Culture,Education,Espionage,Expeditions,"Fashion, Manners and Customs",Food and Diet,Games and Activities,Health,Humor,Indigenous Americans,Love and Relationships,Parenthood and Family,Politics and American History,Race and Civil Rights,"Religion, Spirituality and Faith",Science,Sports and Fitness,Travel
1,CROSS JUSTICE;by James Patterson;New this week,CROSS JUSTICE;by James Patterson;New this week,THE MARTIAN;by Andy Weir;57 weeks on the list,,,KILLING REAGAN;by Bill O'Reilly and Martin Dugard;10 weeks on the list,HUMANS OF NEW YORK: STORIES;by Brandon Stanton;7 weeks on the list,THE BOYS IN THE BOAT;by Daniel James Brown;79 weeks on the list,BOYS IN THE TREES;by Carly Simon;New this week,THING EXPLAINER;by Randall Munroe;New this week,THE SANDMAN;by Neil Gaiman and Dirk Maggs;3 weeks on the list,"THE WALKING DEAD COMPENDIUM, VOL. 3;by Robert Kirkman and Charlie Adlard;7 weeks on the list","ONE-PUNCH MAN, VOL. 1;by ONE and Yusuke Murata;13 weeks on the list",THE ONE AND ONLY IVAN;by Katherine Applegate. Illustrated by Patricia Castelao;3 weeks on the list,THE SWORD OF SUMMER;by Rick Riordan;8 weeks on the list,THE ONE AND ONLY IVAN;by Katherine Applegate. Illustrated by Patricia Castelao;16 weeks on the list,THE DAY THE CRAYONS CAME HOME;by Drew Daywalt. Illustrated by Oliver Jeffers;15 weeks on the list,DIARY OF A WIMPY KID;written and illustrated by Jeff Kinney;350 weeks on the list,THE 5TH WAVE;by Rick Yancey;10 weeks on the list,THE AMAZING BOOK IS NOT ON FIRE;by Dan Howell and Phil Lester;7 weeks on the list,THE 5TH WAVE;by Rick Yancey;15 weeks on the list,DO UNTO ANIMALS;by Tracey Stewart;,EXTREME OWNERSHIP;by Jocko Willink and Leif Babin;,TROUBLEMAKER;by Leah Remini and Rebecca Paley;,NOTORIOUS RBG;by Irin Carmon and Shana Knizhnik;,HUMANS OF NEW YORK: STORIES;by Brandon Stanton;,I AM MALALA;by Malala Yousafzai with Christina Lamb;,STRANGERS ON A BRIDGE;by James Donovan;,THE WRIGHT BROTHERS;by David McCullough;,STRONG LOOKS BETTER NAKED;by Khloe Kardashian;,THE PIONEER WOMAN COOKS: DINNERTIME;by Ree Drummond;,LOST OCEAN;illustrated by Johanna Basford;,STRONG LOOKS BETTER NAKED;by Khloe Kardashian;,WHY NOT ME?;by Mindy Kaling;,THE HEART OF EVERYTHING THAT IS;by Bob Drury and Tom Clavin;,WHY NOT ME?;by Mindy Kaling;,WHAT TO EXPECT WHEN YOU'RE EXPECTING;by Heidi Murkoff and Sharon Mazel;,KILLING REAGAN;by Bill O'Reilly and Martin Dugard;,BETWEEN THE WORLD AND ME;by Ta-Nehisi Coates;,TROUBLEMAKER;by Leah Remini and Rebecca Paley;,THING EXPLAINER;by Randall Munroe;,THE BOYS IN THE BOAT;by Daniel James Brown;,HUMANS OF NEW YORK: STORIES;by Brandon Stanton;
2,TRICKY TWENTY-TWO;by Janet Evanovich;2 weeks on the list,TRICKY TWENTY-TWO;by Janet Evanovich;2 weeks on the list,STARS OF FORTUNE;by Nora Roberts;4 weeks on the list,,,HUMANS OF NEW YORK: STORIES;by Brandon Stanton;4 weeks on the list,KILLING REAGAN;by Bill O'Reilly and Martin Dugard;10 weeks on the list,I AM MALALA;by Malala Yousafzai with Christina Lamb;26 weeks on the list,TROUBLEMAKER;by Leah Remini and Rebecca Paley;4 weeks on the list,THE LIFE-CHANGING MAGIC OF TIDYING UP;by Marie Kondo;57 weeks on the list,BATMAN: THE KILLING JOKE;by Alan Moore and Brian Bolland;180 weeks on the list,DRAMA;by Raina Telgemeier;122 weeks on the list,"TOKYO GHOUL, VOL. 1;by Sui Ishida;24 weeks on the list",THE SWORD OF SUMMER;by Rick Riordan;8 weeks on the list,ROBOTS GO WILD;by James Patterson and Chris Grabenstein. Illustrated by Juliana Neufeld;New this week,HOUSE OF ROBOTS;by James Patterson and Chris Grabenstein. Illustrated by Juliana Neufeld;6 weeks on the list,HOW TO CATCH SANTA;by Jean Reagan. Illustrated by Lee Wildish;2 weeks on the list,HARRY POTTER;by J.K. Rowling;349 weeks on the list,FANGIRL;by Rainbow Rowell;New this week,CARRY ON;by Rainbow Rowell;8 weeks on the list,PAPER TOWNS;by John Green;16 weeks on the list,CATIFY TO SATISFY;by Jackson Galaxy and Kate Benjamin;,THE SCHOOL OF GREATNESS;by Lewis Howes;,WHY NOT ME?;by Mindy Kaling;,THE DEVIL IN THE WHITE CITY;by Erik Larson;,MY LIFE ON THE ROAD;by Gloria Steinem;,THE ORGANIZED MIND;by Daniel J. Levitin;,100 DEADLY SKILLS;by Clint Emerson;,IN THE HEART OF THE SEA;by Nathaniel Philbrick;,TIMELESS BEAUTY;by Christie Brinkley;,NERDY NUMMIES COOKBOOK;by Rosanna Pansino;,HARRY POTTER COLORING BOOK;by various illustrators;,BEING MORTAL;by Atul Gawande;,BINGE;by Tyler Oakley;,EMPIRE OF THE SUMMER MOON;by S.C. Gwynne;,THE FIVE LOVE LANGUAGES;by Gary Chapman;,DARTH VADER AND SON;by Jeffrey Brown;,DESTINY AND POWER;by Jon Meacham;,JUST MERCY;by Bryan Stevenson;,THE WITCHES;by Stacy Schiff;,BEING MORTAL;by Atul Gawande;,ABOVE THE LINE;by Urban Meyer with Wayne Coffey;,MY SOUTHERN JOURNEY;by Rick Bragg;
3,THE GUILTY;by David Baldacci;2 weeks on the list,ROGUE LAWYER;by John Grisham;6 weeks on the list,THE MAN IN THE HIGH CASTLE;by Philip K. Dick;New this week,,,THOMAS JEFFERSON AND THE TRIPOLI PIRATES;by Brian Kilmeade and Don Yaeger;4 weeks on the list,THOMAS JEFFERSON AND THE TRIPOLI PIRATES;by Brian Kilmeade and Don Yaeger;4 weeks on the list,IN THE HEART OF THE SEA;by Nathaniel Philbrick;23 weeks on the list,THE STORY OF THE JEWS;by Simon Schama;2 weeks on the list,THE PIONEER WOMAN COOKS: DINNERTIME;by Ree Drummond;6 weeks on the list,ASTERIX AND THE MISSING SCROLL;by Jean–Yves Ferri and Didier Conrad;New this week,SMILE;by Raina Telgemeier;181 weeks on the list,"TOKYO GHOUL, VOL. 2;by Sui Ishida;13 weeks on the list",THE KEEPER;by David Baldacci;12 weeks on the list,WONDER;by R.J. Palacio;16 weeks on the list,OUT OF MY MIND;by Sharon M. Draper;16 weeks on the list,THE DAY THE CRAYONS QUIT;by Drew Daywalt. Illustrated by Oliver Jeffers;127 weeks on the list,DORK DIARIES;by Rachel Renée Russell;144 weeks on the list,DOROTHY MUST DIE;by Danielle Paige;New this week,"EVERYTHING, EVERYTHING;by Nicola Yoon;12 weeks on the list",THIS BOOK LOVES YOU;by PewDiePie;6 weeks on the list,THE DOGIST;by Elias Weiss Friedman;,ABOVE THE LINE;by Urban Meyer with Wayne Coffey;,WILDFLOWER;by Drew Barrymore;,JUST MERCY;by Bryan Stevenson;,M TRAIN;by Patti Smith;,HOW NOT TO BE WRONG;by Jordan Ellenberg;,BRIDGE OF SPIES;by Giles Whittell;,DEAD WAKE;by Erik Larson;,HOME;by Ellen DeGeneres;,THE FOOD LAB;by J. Kenji Lopez-Alt;,ENCHANTED FOREST;illustrated by Johanna Basford;,FURIOUSLY HAPPY;by Jenny Lawson;,MODERN ROMANCE;by Aziz Ansari with Eric Klinenberg;,TRACE;by Lauret Savoy;,MODERN ROMANCE;by Aziz Ansari with Eric Klinenberg;,THE FIVE LOVE LANGUAGES OF CHILDREN;by Gary D. Chapman and Ross Campbell;,CRIPPLED AMERICA;by Donald J. Trump;,THE NEW JIM CROW;by Michelle Alexander;,THE POWER OF I AM;by Joel Osteen;,THE WRIGHT BROTHERS;by David McCullough;,"50 YEARS, 50 MOMENTS;by Jerry Rice and Randy O. Williams;",HUMANS OF NEW YORK;by Brandon Stanton;
4,SEE ME;by Nicholas Sparks;7 weeks on the list,THE GUILTY;by David Baldacci;2 weeks on the list,THE ALCHEMIST;by Paulo Coelho;382 weeks on the list,,,BOYS IN THE TREES;by Carly Simon;New this week,DESTINY AND POWER;by Jon Meacham;3 weeks on the list,YES PLEASE;by Amy Poehler;13 weeks on the list,THOMAS JEFFERSON AND THE TRIPOLI PIRATES;by Brian Kilmeade and Don Yaeger;4 weeks on the list,YEAR OF YES;by Shonda Rhimes;3 weeks on the list,"AMAZING FANTASTIC INCREDIBLE;by Stan Lee, Peter David and Colleen Doran;4 weeks on the list","THE WALKING DEAD COMPENDIUM, VOL. 1;by Robert Kirkman and others;161 weeks on the list","ONE-PUNCH MAN, VOL. 2;by ONE and Yusuke Murata;8 weeks on the list",WONDER;by R.J. Palacio;15 weeks on the list,THE ISLE OF THE LOST;by Melissa de la Cruz;15 weeks on the list,A LONG WALK TO WATER;by Linda Sue Park;16 weeks on the list,THE NIGHT BEFORE CHRISTMAS;by Clement C. Moore. Various illustrators;62 weeks on the list,RUSH REVERE;by Rush Limbaugh with Kathryn Adams Limbaugh;15 weeks on the list,MAGONIA;by Maria Dahvana Headley;New this week,RED QUEEN;by Victoria Aveyard;15 weeks on the list,LOOKING FOR ALASKA;by John Green;16 weeks on the list,THROUGH A DOG'S EYES;by Jennifer Arnold;,"THINKING, FAST AND SLOW;by Daniel Kahneman;",STRONG LOOKS BETTER NAKED;by Khloe Kardashian;,BLACK MASS;by Dick Lehr and Gerald O'Neill;,SPQR;by Mary Beard;,THE LAST LECTURE;by Randy Pausch with Jeffrey Zaslow;,SPY SECRETS THAT CAN SAVE YOUR LIFE;by Jason Hanson;,INTO THE WILD;by Jon Krakauer;,STYLED;by Emily Henderson and Angelin Borsics;,HAPPY COOKING;by Giada De Laurentiis;,STRESS RELIEVING ANIMAL DESIGNS;by the editors of Blue Star Books;,TIMELESS BEAUTY;by Christie Brinkley;,SELP-HELF;by Miranda Sings;,1491;by Charles C. Mann;,DARING GREATLY;by Brené Brown;,THE WHOLE-BRAIN CHILD;by Daniel J. Siegel and Tina Payne Bryson;,BETWEEN THE WORLD AND ME;by Ta-Nehisi Coates;,THE BOOK OF FORGIVING;by Desmond Tutu;,THE EMMAUS CODE;by David Limbaugh;,UNSTOPPABLE;by Bill Nye. Edited by Corey S. Powell;,MY FIGHT / YOUR FIGHT;by Ronda Rousey with Maria Burns Ortiz;,PACIFIC;by Simon Winchester;
5,ROGUE LAWYER;by John Grisham;6 weeks on the list,THE BAZAAR OF BAD DREAMS;by Stephen King;4 weeks on the list,MY BRILLIANT FRIEND;by Elena Ferrante;13 weeks on the list,,,TROUBLEMAKER;by Leah Remini and Rebecca Paley;4 weeks on the list,WHY NOT ME?;by Mindy Kaling;10 weeks on the list,THE DEVIL IN THE WHITE CITY;by Erik Larson;311 weeks on the list,ASTORIA;by Peter Stark;New this week,BIG MAGIC;by Elizabeth Gilbert;10 weeks on the list,KILLING AND DYING;by Adrian Tomine;8 weeks on the list,SISTERS;by Raina Telgemeier;65 weeks on the list,"TOKYO GHOUL, VOL. 3;by Sui Ishida;6 weeks on the list",THE FINISHER;by David Baldacci;11 weeks on the list,AUGGIE & ME;by R.J. Palacio;15 weeks on the list,THE CARE AND KEEPING OF YOU;by Valorie Schaefer. Illustrated by Josee Masse;16 weeks on the list,THE BOOK WITH NO PICTURES;by B.J. Novak;61 weeks on the list,LUNAR CHRONICLES;by Marissa Meyer;11 weeks on the list,THE INFINITE SEA;by Rick Yancey;4 weeks on the list,FANGIRL;by Rainbow Rowell;15 weeks on the list,ME AND EARL AND THE DYING GIRL;by Jesse Andrews;16 weeks on the list,THE HORSE;by Wendy Williams;,OUTLIERS;by Malcolm Gladwell;,BINGE;by Tyler Oakley;,MERCHANTS IN THE TEMPLE;by Gianluigi Nuzzi;,HUMANS OF NEW YORK;by Brandon Stanton;,THE PRIZE;by Dale Russakoff;,BLACK MASS;by Dick Lehr and Gerald O'Neill;,ASTORIA;by Peter Stark;,LOVE STYLE LIFE;by Garance Doré;,THE 20/20 DIET;by Phil McGraw;,SECRET GARDEN;illustrated by Johanna Basford;,10-DAY GREEN SMOOTHIE CLEANSE;by J. J. Smith;,YES PLEASE;by Amy Poehler;,BORN TO RUN;by Christopher McDougall;,DEAR MR. YOU;by Mary-Louise Parker;,LITTLE VICTORIES;by Jason Gay;,LIGHTS OUT;by Ted Koppel;,CITIZEN;by Claudia Rankine;,THE FOUR AGREEMENTS;by Don Miguel Ruiz;,QUIET;by Susan Cain;,THE ART OF PEACE;by Morihei Ueshiba. Translated and edited by John Stevens;,WILD;by Cheryl Strayed;
6,THE MARTIAN;by Andy Weir;27 weeks on the list,SEE ME;by Nicholas Sparks;7 weeks on the list,READY PLAYER ONE;by Ernest Cline;14 weeks on the list,,,BETWEEN THE WORLD AND ME;by Ta-Nehisi Coates;20 weeks on the list,BETWEEN THE WORLD AND ME;by Ta-Nehisi Coates;20 weeks on the list,ALEXANDER HAMILTON;by Ron Chernow;7 weeks on the list,THE LIGHT BETWEEN US;by Laura Lynne Jackson;New this week,THE POWER OF I AM;by Joel Osteen;8 weeks on the list,"STEP ASIDE, POPS;by Kate Beaton;11 weeks on the list","THE WALKING DEAD COMPENDIUM, VOL. 2;by Robert Kirkman and Charlie Adlard;88 weeks on the list","NORAGAMI, VOL. 8;by Adachitoka;New this week",,PERCY JACKSON'S GREEK HEROES;by Rick Riordan. Illustrated by John Rocco;11 weeks on the list,GOOSEBUMPS MOVIE NOVEL;Edited by R. L. Stine;7 weeks on the list,THE LITTLE SNOWPLOW;by Lora Koehler. Illustrated by Jake Parker;4 weeks on the list,MISS PEREGRINE’S PECULIAR CHILDREN;by Ransom Riggs;10 weeks on the list,,ILLUMINAE;by Amie Kaufman and Jay Kristoff;6 weeks on the list,THE INFINITE SEA;by Rick Yancey;4 weeks on the list,BUFFALO FOR THE BROKEN HEART;by Dan O'Brien;,THE POWER OF HABIT;by Charles Duhigg;,FURIOUSLY HAPPY;by Jenny Lawson;,SOMEONE'S DAUGHTER;by Silvia Pettem;,THIS OLD MAN;by Roger Angell;,THE OPPOSITE OF LONELINESS;by Marina Keegan;,THE DEVIL'S CHESSBOARD;by David Talbot;,PACIFIC;by Simon Winchester;,HOW TO TIE A SCARF;by the staff of Potter Style;,10-DAY GREEN SMOOTHIE CLEANSE;by J. J. Smith;,VAULT DWELLER'S SURVIVAL GUIDE;by David Hodgson and Nick von Esmarch;,TOUGH AS THEY COME;by Travis Mills with Marcus Brotherton;,BASSOON KING;by Rainn Wilson;,,LOVE DOES;by Bob Goff;,GO THE -- TO SLEEP;by Adam Mansbach. Illustrated by Ricardo Cortés;,A MORE PERFECT UNION;by Ben Carson with Candy Carson;,THE SHORT AND TRAGIC LIFE OF ROBERT PEACE;by Jeff Hobbs;,FOR THE LOVE;by Jen Hatmaker;,WHAT IF?;by Randall Munroe;,SUPER BOWL GOLD;by the editors of Sports Illustrated;,A WALK IN THE WOODS;by Bill Bryson;
7,THE CROSSING;by Michael Connelly;4 weeks on the list,THE MAGIC STRINGS OF FRANKIE PRESTO;by Mitch Albom;3 weeks on the list,EVERYTHING I NEVER TOLD YOU;by Celeste Ng;24 weeks on the list,,,DESTINY AND POWER;by Jon Meacham;3 weeks on the list,TROUBLEMAKER;by Leah Remini and Rebecca Paley;4 weeks on the list,QUIET;by Susan Cain;119 weeks on the list,KILLING REAGAN;by Bill O'Reilly and Martin Dugard;10 weeks on the list,THE FOOD LAB;by J. Kenji Lopez-Alt;4 weeks on the list,CAN'T WE TALK ABOUT SOMETHING MORE PLEASANT?;by Roz Chast;82 weeks on the list,THE BABY-SITTERS CLUB GRAPHIX: KRISTY'S GREAT IDEA;by Ann M. Martin and Raina Telgemeier;29 weeks on the list,"MY HERO ACADEMIA, VOL. 2;by Kohei Horikoshi;4 weeks on the list",,CRENSHAW;by Katherine Applegate;10 weeks on the list,THE PRINCESS IN BLACK;by Shannon Hale and Dean Hale. Illustrated by LeUyen Pham;16 weeks on the list,DRAGONS LOVE TACOS;by Adam Rubin. Illustrated by Daniel Salmieri;93 weeks on the list,THE MAZE RUNNER;by James Dashner;164 weeks on the list,,ELEANOR AND PARK;by Rainbow Rowell;14 weeks on the list,THE BOOK THIEF;by Markus Zusak;16 weeks on the list,RESCUE ROAD;by Peter Zheutlin;,GOOD PROFIT;by Charles G. Koch;,M TRAIN;by Patti Smith;,THE SHORT AND TRAGIC LIFE OF ROBERT PEACE;by Jeff Hobbs;,THE RAP YEAR BOOK;by Shea Serrano and Arturo Torres;,HOW TO RAISE AN ADULT;by Julie Lythcott-Haims;,RED NOTICE;by Bill Browder;,THE OREGON TRAIL;by Rinker Buck;,EMPIRE OF COTTON;by Sven Beckert;,THUG KITCHEN;by the staff of Thug Kitchen;,ADULT COLORING BOOKS;by the staff of Coloring Books for Adults;,THE BODY KEEPS THE SCORE;by Bessel van der Kolk;,NOT THAT KIND OF GIRL;by Lena Dunham;,,THE ANDY COHEN DIARIES;by Andy Cohen;,WALK TO BEAUTIFUL;by Jimmy Wayne with Ken Abraham;,MY LIFE ON THE ROAD;by Gloria Steinem;,GHETTOSIDE;by Jill Leovy;,IMAGINE HEAVEN;by John Burke;,"THINKING, FAST AND SLOW;by Daniel Kahneman;",ALONE ON THE WALL;by Alex Honnold with David Roberts;,"RARELY SEEN;by the staff of National Geographic, Stephen Alvarez and Susan Tyler Hitchcock;"
8,THE BAZAAR OF BAD DREAMS;by Stephen King;4 weeks on the list,ALL THE LIGHT WE CANNOT SEE;by Anthony Doerr;82 weeks on the list,"MERRY CHRISTMAS, ALEX CROSS;by James Patterson;4 weeks on the list",,,WHY NOT ME?;by Mindy Kaling;11 weeks on the list,BINGE;by Tyler Oakley;6 weeks on the list,JUST MERCY;by Bryan Stevenson;10 weeks on the list,BETWEEN THE WORLD AND ME;by Ta-Nehisi Coates;7 weeks on the list,STRONG LOOKS BETTER NAKED;by Khloe Kardashian;4 weeks on the list,101 ARTISTS TO LISTEN TO BEFORE YOU DIE;by Ricardo Cavolo;3 weeks on the list,THE BABY-SITTERS CLUB GRAPHIX: MARY ANNE SAVES THE DAY;by Ann M. Martin and Raina Telgemeier;7 weeks on the list,"NARUTO, VOL. 72;by Masashi Kishimoto;7 weeks on the list",,THE STORY OF DIVA AND FLEA;by Mo Willems. Illustrated by Tony DiTerlizzi;6 weeks on the list,FLORA AND ULYSSES;by Kate DiCamillo. Illustrated by K. G. Campbell;5 weeks on the list,THE WONDERFUL THINGS YOU WILL BE;by Emily Winfield Martin;11 weeks on the list,DESCENDANTS;by various authors;15 weeks on the list,,WE ALL LOOKED UP;by Tommy Wallach;7 weeks on the list,AN ABUNDANCE OF KATHERINES;by John Green;14 weeks on the list,TOUCHING THE WILD;by Joe Hutto;,THE COURAGE TO ACT;by Ben S. Bernanke;,BOYS IN THE TREES;by Carly Simon;,RED NOTICE;by Bill Browder;,BOB DYLAN: ALL THE SONGS;by Philippe Margotin and Jean-Michel Guesdon;,HOW WE LEARN;by Benedict Carey;,"LIAR, TEMPTRESS, SOLDIER, SPY;by Karen Abbott;",THE INVENTION OF NATURE;by Andrea Wulf;,I'LL NEVER WRITE MY MEMOIRS;by Grace Jones as told to Paul Morley;,THE WHOLE30;by Melissa Hartwig and Dallas Hartwig;,CREATIVE HAVEN CREATIVE CATS COLORING BOOK;Illustrated by Marjorie Sarnat;,MEDICAL MEDIUM;by Anthony William;,IS EVERYONE HANGING OUT WITHOUT ME?;by Mindy Kaling;,,THE FIVE LOVE LANGUAGES OF CHILDREN;by Gary D. Chapman and Ross Campbell;,VADER'S LITTLE PRINCESS;by Jeffrey Brown;,I AM MALALA;by Malala Yousafzai with Christina Lamb;,BLACK MAN IN A WHITE COAT;by Damon Tweedy;,MAGICIANS OF THE GODS;by Graham Hancock;,THE POWER OF HABIT;by Charles Duhigg;,THE THREE-YEAR SWIM CLUB;by Julie Checkoway;,BELLA TUSCANY;by Frances Mayes;
9,WILD CAT;by Christine Feehan;New this week,THE CROSSING;by Michael Connelly;4 weeks on the list,GREY;by E. L. James;23 weeks on the list,,,THE BOYS IN THE BOAT;by Daniel James Brown;80 weeks on the list,BOYS IN THE TREES;by Carly Simon;New this week,"THINKING, FAST AND SLOW;by Daniel Kahneman;99 weeks on the list",SPQR;by Mary Beard;New this week,SELP-HELF;by Miranda Sings;8 weeks on the list,THE BEST AMERICAN COMICS 2015;edited by Jonathan Lethem;8 weeks on the list,"RICK AND MORTY, VOL. 1;by Zac Gorman and CJ Cannon;New this week","UQ HOLDER, VOL. 6;by Ken Akamatsu;New this week",,THE PRINCESS IN BLACK AND THE PERFECT PRINCESS PARTY;by Shannon Hale and Dean Hale. Illustrated by LeUyen Pham;7 weeks on the list,ESCAPE FROM MR. LEMONCELLO’S LIBRARY;by Chris Grabenstein;13 weeks on the list,WHAT PET SHOULD I GET?;by Dr. Seuss;18 weeks on the list,THE HUNGER GAMES;by Suzanne Collins;225 weeks on the list,,GIRL ONLINE: ON TOUR;by Zoe Sugg;5 weeks on the list,THE FAULT IN OUR STARS;by John Green;12 weeks on the list,THE LIVING BIRD;Photography by Gerrit Vyn. Essays by various authors;,#GIRLBOSS;by Sophia Amoruso;,BUT ENOUGH ABOUT ME;by Burt Reynolds and Jon Winokur;,TINSELTOWN;by William J. Mann;,SAM PHILLIPS;by Peter Guralnick;,ON WRITING;by Stephen King;,GEORGE WASHINGTON'S SECRET SIX;by Brian Kilmeade and Don Yaeger;,DEEP DOWN DARK;by Hector Tobar;,MY JOURNEY;by Donna Karan;,THE PIONEER WOMAN COOKS: A YEAR OF HOLIDAYS;by Ree Drummond;,THE OFFICIAL A GAME OF THRONES COLORING BOOK;various illustrators;,INTERNAL MEDICINE;by Terrence Holt;,BOSSYPANTS;by Tina Fey;,,THE BOOK OF FORGIVING;by Desmond Tutu;,H IS FOR HAWK;by Helen Macdonald;,GOVERNMENT ZERO;by Michael Savage;,NEGROLAND;by Margo Jefferson;,THE LIGHT BETWEEN US;by Laura Lynne Jackson;,DO UNTO ANIMALS;by Tracey Stewart;,UNBROKEN;by Laura Hillenbrand;,THE ONLY STREET IN PARIS;by Elaine Sciolino;
10,ALL THE LIGHT WE CANNOT SEE;by Anthony Doerr;62 weeks on the list,GO SET A WATCHMAN;by Harper Lee;19 weeks on the list,BROOKLYN;by Colm Toibin;5 weeks on the list,,,BINGE;by Tyler Oakley;5 weeks on the list,THE WITCHES;by Stacy Schiff;5 weeks on the list,CITIZEN;by Claudia Rankine;3 weeks on the list,THE BOYS IN THE BOAT;by Daniel James Brown;97 weeks on the list,THE FIVE LOVE LANGUAGES;by Gary Chapman;131 weeks on the list,HERE;by Richard McGuire;30 weeks on the list,THE BABY-SITTERS CLUB GRAPHIX: THE TRUTH ABOUT STACEY;by Ann M. Martin and Raina Telgemeier;8 weeks on the list,"ONE-PUNCH MAN, VOL. 3;by ONE and Yusuke Murata;4 weeks on the list",,THE MARVELS;by Brian Selznick;9 weeks on the list,COUNTING BY 7s;by Holly Goldberg Sloan;11 weeks on the list,THE NOT VERY MERRY POUT-POUT FISH;by Deborah Diesen. Illustrated by Dan Hanna;2 weeks on the list,THE TWILIGHT SAGA;by Stephenie Meyer;226 weeks on the list,,ALL THE BRIGHT PLACES;by Jennifer Niven;9 weeks on the list,I'LL GIVE YOU THE SUN;by Jandy Nelson;5 weeks on the list,FELINES OF NEW YORK;by Jim Tews;,MONEY: MASTER THE GAME;by Tony Robbins;,PETTY;by Warren Zanes;,MY STORY;by Elizabeth Smart with Chris Stewart;,PHOTOGRAPHY;by Tom Ang;,A LITTLE HISTORY OF THE WORLD;by E. H. Gombrich and Clifford Harper. Translated by Caroline Mustill;,AGENT STORM;by Morten Storm with Paul Cruickshank and Tim Lister;,ATLAS OF CURSED PLACES;by Olivier Le Carrer;,FACE PAINT;by Lisa Eldridge;,THE PIONEER WOMAN COOKS: FOOD FROM MY FRONTIER;by Ree Drummond;,CREATIVE HAVEN ART NOUVEAU ANIMAL DESIGNS COLORING BOOK;Illustrated by Marty Noble;,A COMMON STRUGGLE;by Patrick J. Kennedy and Stephen Fried;,ALMOST INTERESTING;by David Spade;,,TINY BEAUTIFUL THINGS;by Cheryl Strayed;,HOW TO LOVE;by Thich Nhat Hanh. Illustrated by Jason DeAntonis;,NOTORIOUS RBG;by Irin Carmon and Shana Knizhnik;,TRACE;by Lauret Savoy;,IT IS ABOUT ISLAM;by Glenn Beck;,ELON MUSK;by Ashlee Vance;,I FEEL LIKE GOING ON;by Ray Lewis with Daniel Paisner;,PRISONERS OF GEOGRAPHY;by Tim Marshall;
11,STARS OF FORTUNE;by Nora Roberts;4 weeks on the list,THE GIRL ON THE TRAIN;by Paula Hawkins;46 weeks on the list,ORPHAN TRAIN;by Christina Baker Kline;,,,THE WITCHES;by Stacy Schiff;5 weeks on the list,THE WRIGHT BROTHERS;by David McCullough;25 weeks on the list,OUTLIERS;by Malcolm Gladwell;,THRIVE;by Arianna Huffington;,NERDY NUMMIES COOKBOOK;by Rosanna Pansino;,,,,,,,,,,,,,,,,,,,,,THE COMPLETE AMERICA'S TEST KITCHEN TV SHOW COOKBOOK 2001-2016;by the editors of America's Test Kitchen;,,,,,,,,,,INTERNAL MEDICINE;by Terrence Holt;,FIND A WAY;by Diana Nyad;,
12,THE GIRL ON THE TRAIN;by Paula Hawkins;44 weeks on the list,ALL DRESSED IN WHITE;by Mary Higgins Clark and Alafair Burke;2 weeks on the list,WINTER STREET;by Elin Hilderbrand;,,,SPQR;by Mary Beard;2 weeks on the list,CRIPPLED AMERICA;by Donald J. Trump;4 weeks on the list,IS EVERYONE HANGING OUT WITHOUT ME?;by Mindy Kaling;,WHY NOT ME?;by Mindy Kaling;,GOOD AND CHEAP;by Leanne Brown;,,,,,,,,,,,,,,,,,,,,,THE BLUE BLOODS COOKBOOK;by Wendy Howard Goldberg and Bridget Moynahan with Chris Peterson;,,,,,,,,,,DARK MATTER AND THE DINOSAURS;by Lisa Randall;,THE LEDGE;by James West Davidson and Kevin Vaughan;,
13,THE MAN IN THE HIGH CASTLE;by Philip K. Dick;New this week,THE PHARAOH'S SECRET;by Clive Cussler and Graham Brown;2 weeks on the list,THE HUSBAND'S SECRET;by Liane Moriarty;,,,THE WRIGHT BROTHERS;by David McCullough;24 weeks on the list,WHAT IF?;by Randall Munroe;37 weeks on the list,IT IS ABOUT ISLAM;by Glenn Beck;,THE LEDGE;by James West Davidson and Kevin Vaughan;,THUG KITCHEN;by the staff of Thug Kitchen;,,,,,,,,,,,,,,,,,,,,,THE SOUTHERNER'S COOKBOOK;by the editors of Garden and Gun;,,,,,,,,,,THROUGH A DOG'S EYES;by Jennifer Arnold;,"2,100 ASANAS;by Daniel Lacerda;",
14,THE MAGIC STRINGS OF FRANKIE PRESTO;by Mitch Albom;2 weeks on the list,THE MISTLETOE INN;by Richard Paul Evans;2 weeks on the list,STATION ELEVEN;by Emily St. John Mandel;,,,THE LIGHT BETWEEN US;by Laura Lynne Jackson;New this week,MY LIFE ON THE ROAD;by Gloria Steinem;5 weeks on the list,UNBROKEN;by Laura Hillenbrand;,LIGHTS OUT;by Ted Koppel;,THE GIFTS OF IMPERFECTION;by Brené Brown;,,,,,,,,,,,,,,,,,,,,,GREAT FOOD FAST;by Bob Warden and Christian Stella;,,,,,,,,,,THE BODY KEEPS THE SCORE;by Bessel van der Kolk;,HOCKEY'S GREATEST;by the editors of Sports Illustrated;,
15,ALL DRESSED IN WHITE;by Mary Higgins Clark and Alafair Burke;2 weeks on the list,RULES FOR A KNIGHT;by Ethan Hawke;2 weeks on the list,AT THE WATER'S EDGE;by Sara Gruen;,,,I AM MALALA;by Malala Yousafzai with Christina Lamb;36 weeks on the list,LIGHTS OUT;by Ted Koppel;5 weeks on the list,NOT THAT KIND OF GIRL;by Lena Dunham;,MODERN ROMANCE;by Aziz Ansari with Eric Klinenberg;,RISING STRONG;by Brené Brown;,,,,,,,,,,,,,,,,,,,,,EVERYONE IS ITALIAN ON SUNDAY;by Rachael Ray;,,,,,,,,,,DAVID AND GOLIATH;by Malcolm Gladwell;,THE MATHENY MANIFESTO;by Mike Matheny with Jerry B. Jenkins;,
