,Combined Print & E-Book Fiction,Hardcover Fiction,Paperback Trade Fiction,Paperback Mass-Market Fiction,E-Book Fiction,Combined Print & E-Book Nonfiction,Hardcover Nonfiction,Paperback Nonfiction,E-Book Nonfiction,"Advice, How-To & Miscellaneous",Hardcover Graphic Books,Paperback Graphic Books,Manga,Children’s Middle Grade E-Book,Children’s Middle Grade Hardcover,Children’s Middle Grade Paperback,Children’s Picture Books,Children’s Series,Young Adult E-Book,Young Adult Hardcover,Young Adult Paperback,Animals,Business,Celebrities,Crime and Punishment,Culture,Education,Espionage,Expeditions,"Fashion, Manners and Customs",Food and Diet,Games and Activities,Health,Humor,Indigenous Americans,Love and Relationships,Parenthood and Family,Politics and American History,Race and Civil Rights,"Religion, Spirituality and Faith",Science,Sports and Fitness,Travel
1,BLUE;by Danielle Steel;New this week,BLUE;by Danielle Steel;New this week,THE REVENANT;by Michael Punke;5 weeks on the list,,,WHEN BREATH BECOMES AIR;by Paul Kalanithi;2 weeks on the list,WHEN BREATH BECOMES AIR;by Paul Kalanithi;2 weeks on the list,13 HOURS;by Mitchell Zuckoff with members of the Annex Security Team;5 weeks on the list,WHEN BREATH BECOMES AIR;by Paul Kalanithi;2 weeks on the list,THE LIFE-CHANGING MAGIC OF TIDYING UP;by Marie Kondo;65 weeks on the list,"AMAZING FANTASTIC INCREDIBLE;by Stan Lee, Peter David and Colleen Doran;11 weeks on the list",DRAMA;by Raina Telgemeier;130 weeks on the list,"ONE-PUNCH MAN, VOL. 4;by ONE and Yusuke Murata;3 weeks on the list",THE SWORD OF SUMMER;by Rick Riordan;16 weeks on the list,WONDER;by R.J. Palacio;24 weeks on the list,THE ONE AND ONLY IVAN;by Katherine Applegate. Illustrated by Patricia Castelao;24 weeks on the list,LAST STOP ON MARKET STREET;by Matt de la Peña. Illustrated by Christian Robinson;5 weeks on the list,HARRY POTTER;by J.K. Rowling;357 weeks on the list,THE 5TH WAVE;by Rick Yancey;18 weeks on the list,THE AMAZING BOOK IS NOT ON FIRE;by Dan Howell and Phil Lester;15 weeks on the list,THE 5TH WAVE;by Rick Yancey;23 weeks on the list,H IS FOR HAWK;by Helen Macdonald;,THE BIG SHORT;by Michael Lewis;,YES PLEASE;by Amy Poehler;,THE DEVIL IN THE WHITE CITY;by Erik Larson;,HUMANS OF NEW YORK: STORIES;by Brandon Stanton;,I AM MALALA;by Malala Yousafzai with Christina Lamb;,100 DEADLY SKILLS;by Clint Emerson;,THE WRIGHT BROTHERS;by David McCullough;,THE RESIDENCE;by Kate Andersen Brower;,ALWAYS HUNGRY?;by David Ludwig;,HARRY POTTER COLORING BOOK;by various illustrators;,WHEN BREATH BECOMES AIR;by Paul Kalanithi;,MODERN ROMANCE;by Aziz Ansari with Eric Klinenberg;,,THE FIVE LOVE LANGUAGES;by Gary Chapman;,WHAT TO EXPECT WHEN YOU'RE EXPECTING;by Heidi Murkoff and Sharon Mazel;,13 HOURS;by Mitchell Zuckoff with members of the Annex Security Team;,BETWEEN THE WORLD AND ME;by Ta-Nehisi Coates;,THE NAME OF GOD IS MERCY;by Pope Francis with Andrea Tornielli;,WHEN BREATH BECOMES AIR;by Paul Kalanithi;,THE BOYS IN THE BOAT;by Daniel James Brown;,THE ROAD TO LITTLE DRIBBLING;by Bill Bryson;
2,FEVERBORN;by Karen Marie Moning;New this week,MY NAME IS LUCY BARTON;by Elizabeth Strout;2 weeks on the list,THE MARTIAN;by Andy Weir;65 weeks on the list,,,13 HOURS;by Mitchell Zuckoff with members of the Annex Security Team;8 weeks on the list,THE NAME OF GOD IS MERCY;by Pope Francis with Andrea Tornielli;2 weeks on the list,THE BIG SHORT;by Michael Lewis;55 weeks on the list,13 HOURS;by Mitchell Zuckoff with members of the Annex Security Team;6 weeks on the list,SPARK JOY;by Marie Kondo;3 weeks on the list,BATMAN: THE KILLING JOKE;by Alan Moore and Brian Bolland;188 weeks on the list,FUN HOME;by Alison Bechdel;45 weeks on the list,NARUTO: THE SEVENTH HOKAGE AND THE SCARLET SPRING;by Masashi Kishimoto;3 weeks on the list,THE ONE AND ONLY IVAN;by Katherine Applegate. Illustrated by Patricia Castelao;8 weeks on the list,THE SWORD OF SUMMER;by Rick Riordan;16 weeks on the list,A LONG WALK TO WATER;by Linda Sue Park;24 weeks on the list,LOVE FROM THE VERY HUNGRY CATERPILLAR;by Eric Carle;2 weeks on the list,DIARY OF A WIMPY KID;written and illustrated by Jeff Kinney;358 weeks on the list,THE INFINITE SEA;by Rick Yancey;12 weeks on the list,RED QUEEN;by Victoria Aveyard;23 weeks on the list,THE INFINITE SEA;by Rick Yancey;12 weeks on the list,THE HORSE;by Wendy Williams;,THE POWER OF BROKE;by Daymond John;,NOT MY FATHER'S SON;by Alan Cumming;,JUST MERCY;by Bryan Stevenson;,SPQR;by Mary Beard;,THEY SAY / I SAY;by Gerald Graff and Cathy Birkenstein;,ZERO FOOTPRINT;by Simon Chase and Ralph Pezzullo;,DEAD WAKE;by Erik Larson;,STRONG LOOKS BETTER NAKED;by Khloe Kardashian;,THE WHOLE30;by Melissa Hartwig and Dallas Hartwig;,LOST OCEAN;illustrated by Johanna Basford;,ALWAYS HUNGRY?;by David Ludwig;,YES PLEASE;by Amy Poehler;,,DARING GREATLY;by Brené Brown;,H IS FOR HAWK;by Helen Macdonald;,BETWEEN THE WORLD AND ME;by Ta-Nehisi Coates;,THE NEW JIM CROW;by Michelle Alexander;,THE FOUR AGREEMENTS;by Don Miguel Ruiz;,ALWAYS HUNGRY?;by David Ludwig;,CONCUSSION;by Jeanne Marie Laskas;,HUMANS OF NEW YORK: STORIES;by Brandon Stanton;
3,THE CHOICE;by Nicholas Sparks;5 weeks on the list,ALL THE LIGHT WE CANNOT SEE;by Anthony Doerr;90 weeks on the list,MY BRILLIANT FRIEND;by Elena Ferrante;21 weeks on the list,,,THE ROAD TO LITTLE DRIBBLING;by Bill Bryson;New this week,BETWEEN THE WORLD AND ME;by Ta-Nehisi Coates;28 weeks on the list,THE BOYS IN THE BOAT;by Daniel James Brown;87 weeks on the list,THE ROAD TO LITTLE DRIBBLING;by Bill Bryson;New this week,PRESENCE;by Amy Cuddy;5 weeks on the list,KILLING AND DYING;by Adrian Tomine;16 weeks on the list,STAR WARS: LANDO;by Charles Soule and Alex Maleev;New this week,"ONE-PUNCH MAN, VOL. 1;by ONE and Yusuke Murata;21 weeks on the list",SERAFINA AND THE BLACK CLOAK;by Robert Beatty;15 weeks on the list,STAR WARS: THE FORCE AWAKENS;by Greg Rucka. Illustrated by Phil Noto;5 weeks on the list,OUT OF MY MIND;by Sharon M. Draper;24 weeks on the list,FINDING WINNIE;by Lindsay Mattick. Illustrated by Sophie Blackall;2 weeks on the list,DIVERGENT;by Veronica Roth;97 weeks on the list,RED QUEEN;by Victoria Aveyard;5 weeks on the list,PASSENGER;by Alexandra Bracken;3 weeks on the list,LOOKING FOR ALASKA;by John Green;24 weeks on the list,WHAT THE DOG KNOWS;by Cat Warren;,A PASSION FOR LEADERSHIP;by Robert M. Gates;,WHY NOT ME?;by Mindy Kaling;,NOTORIOUS RBG;by Irin Carmon and Shana Knizhnik;,LADY ALMINA AND THE REAL DOWNTON ABBEY;by The Countess of Carnarvon;,THE WATER IS WIDE;by Pat Conroy;,BLACK MASS;by Dick Lehr and Gerald O'Neill;,IN THE HEART OF THE SEA;by Nathaniel Philbrick;,RED;by Jacky Colliss Harvey;,10-DAY GREEN SMOOTHIE CLEANSE;by J. J. Smith;,ENCHANTED FOREST;illustrated by Johanna Basford;,10-DAY GREEN SMOOTHIE CLEANSE;by J. J. Smith;,WHY NOT ME?;by Mindy Kaling;,,MODERN ROMANCE;by Aziz Ansari with Eric Klinenberg;,THE SOUND OF GRAVEL;by Ruth Wariner;,THE BIG SHORT;by Michael Lewis;,JUST MERCY;by Bryan Stevenson;,FERVENT;by Priscilla Shirer;,THING EXPLAINER;by Randall Munroe;,UNBROKEN;by Laura Hillenbrand;,A THOUSAND DAYS IN VENICE;by Marlena de Blasi;
4,MY NAME IS LUCY BARTON;by Elizabeth Strout;2 weeks on the list,THE GIRL ON THE TRAIN;by Paula Hawkins;54 weeks on the list,BROOKLYN;by Colm Toibin;13 weeks on the list,,,DARK MONEY;by Jane Mayer;New this week,THE ROAD TO LITTLE DRIBBLING;by Bill Bryson;New this week,I AM MALALA;by Malala Yousafzai with Christina Lamb;34 weeks on the list,DARK MONEY;by Jane Mayer;New this week,ALWAYS HUNGRY?;by David Ludwig;3 weeks on the list,ROSALIE LIGHTNING;by Tom Hart;2 weeks on the list,PERSEPOLIS;by Marjane Satrapi;64 weeks on the list,"ONE-PUNCH MAN, VOL. 3;by ONE and Yusuke Murata;10 weeks on the list",THE KEEPER;by David Baldacci;17 weeks on the list,AUGGIE & ME;by R.J. Palacio;23 weeks on the list,THE CARE AND KEEPING OF YOU;by Valorie Schaefer. Illustrated by Josee Masse;24 weeks on the list,THE DAY THE CRAYONS QUIT;by Drew Daywalt. Illustrated by Oliver Jeffers;135 weeks on the list,MISS PEREGRINE’S PECULIAR CHILDREN;by Ransom Riggs;18 weeks on the list,WE WERE LIARS;by E. Lockhart;11 weeks on the list,SIX OF CROWS;by Leigh Bardugo;16 weeks on the list,THE BOOK THIEF;by Markus Zusak;24 weeks on the list,THE SOUL OF AN OCTOPUS;by Sy Montgomery;,THE POWER OF HABIT;by Charles Duhigg;,FURIOUSLY HAPPY;by Jenny Lawson;,SISTERS IN LAW;by Linda Hirshman;,MY LIFE ON THE ROAD;by Gloria Steinem;,IN A DIFFERENT KEY;by John Donvan and Caren Zucker;,THE PENTAGON'S BRAIN;by Annie Jacobsen;,INTO THE WILD;by Jon Krakauer;,EMPIRE OF COTTON;by Sven Beckert;,THE PIONEER WOMAN COOKS: DINNERTIME;by Ree Drummond;,STRESS RELIEVING ANIMAL DESIGNS;by the editors of Blue Star Books;,BEING MORTAL;by Atul Gawande;,BINGE;by Tyler Oakley;,,H IS FOR HAWK;by Helen Macdonald;,THE FIVE LOVE LANGUAGES OF CHILDREN;by Gary D. Chapman and Ross Campbell;,KILLING REAGAN;by Bill O'Reilly and Martin Dugard;,CITIZEN;by Claudia Rankine;,IMAGINE HEAVEN;by John Burke;,BEING MORTAL;by Atul Gawande;,WAKE UP HAPPY;by Michael Strahan with Veronica Chambers;,WILD;by Cheryl Strayed;
5,THE REVENANT;by Michael Punke;4 weeks on the list,THE NIGHTINGALE;by Kristin Hannah;47 weeks on the list,THE ALCHEMIST;by Paulo Coelho;390 weeks on the list,,,BETWEEN THE WORLD AND ME;by Ta-Nehisi Coates;28 weeks on the list,DARK MONEY;by Jane Mayer;New this week,THE DEVIL IN THE WHITE CITY;by Erik Larson;319 weeks on the list,THE INDIFFERENT STARS ABOVE;by Daniel James Brown;New this week,THE FIVE LOVE LANGUAGES;by Gary Chapman;137 weeks on the list,HILO BOOK 1: THE BOY WHO CRASHED TO EARTH;by Judd Winick;New this week,"JESSICA JONES: ALIAS, VOL. 4;by Brian Michael Bendis and Michael Gaydos;New this week","ONE-PUNCH MAN, VOL. 2;by ONE and Yusuke Murata;15 weeks on the list",OUT OF MY MIND;by Sharon M. Draper;2 weeks on the list,MR. LEMONCELLO'S LIBRARY OLYMPICS;by Chris Grabenstein;3 weeks on the list,ESCAPE FROM MR. LEMONCELLO’S LIBRARY;by Chris Grabenstein;21 weeks on the list,THE DAY THE CRAYONS CAME HOME;by Drew Daywalt. Illustrated by Oliver Jeffers;23 weeks on the list,DORK DIARIES;by Rachel Renée Russell;152 weeks on the list,A COURT OF THORNS AND ROSES;by Sarah J. Maas;3 weeks on the list,CARRY ON;by Rainbow Rowell;16 weeks on the list,ME AND EARL AND THE DYING GIRL;by Jesse Andrews;24 weeks on the list,DO UNTO ANIMALS;by Tracey Stewart;,HOW TO MAKE YOUR MONEY LAST;by Jane Bryant Quinn;,BOYS IN THE TREES;by Carly Simon;,MISSOULA;by Jon Krakauer;,DOWNTON ABBEY: A CELEBRATION;by Jessica Fellowes;,MISSOULA;by Jon Krakauer;,SPY SECRETS THAT CAN SAVE YOUR LIFE;by Jason Hanson;,THE INDIFFERENT STARS ABOVE;by Daniel James Brown;,TIMELESS BEAUTY;by Christie Brinkley;,THE NEGATIVE CALORIE DIET;by Rocco DiSpirito;,SECRET GARDEN;illustrated by Johanna Basford;,THE SHRED POWER CLEANSE;by Ian K. Smith;,SELP-HELF;by Miranda Sings;,,WHY NOT ME?;by Mindy Kaling;,THE GLASS CASTLE;by Jeannette Walls;,DARK MONEY;by Jane Mayer;,AMERICA'S ORIGINAL SIN;by Jim Wallis;,THE POWER OF I AM;by Joel Osteen;,THE WRIGHT BROTHERS;by David McCullough;,LIFE IS NOT AN ACCIDENT;by Jay Williams;,THE GEOGRAPHY OF GENIUS;by Eric Weiner;
6,THE BALLER;by Vi Keeland;New this week,THE FORCE AWAKENS;by Alan Dean Foster;3 weeks on the list,A MAN CALLED OVE;by Fredrik Backman;4 weeks on the list,,,THE NAME OF GOD IS MERCY;by Pope Francis with Andrea Tornielli;2 weeks on the list,KILLING REAGAN;by Bill O'Reilly and Martin Dugard;18 weeks on the list,ALEXANDER HAMILTON;by Ron Chernow;15 weeks on the list,BETWEEN THE WORLD AND ME;by Ta-Nehisi Coates;15 weeks on the list,THE NEGATIVE CALORIE DIET;by Rocco DiSpirito;3 weeks on the list,"STEP ASIDE, POPS;by Kate Beaton;19 weeks on the list",SMILE;by Raina Telgemeier;189 weeks on the list,"TWIN STAR EXORCISTS, VOL. 3;by Yoshiaki Sukeno;2 weeks on the list",,ROBOTS GO WILD;by James Patterson and Chris Grabenstein. Illustrated by Juliana Neufeld;9 weeks on the list,HOUSE OF ROBOTS;by James Patterson and Chris Grabenstein. Illustrated by Juliana Neufeld;14 weeks on the list,THE WONDERFUL THINGS YOU WILL BE;by Emily Winfield Martin;18 weeks on the list,THE MORTAL INSTRUMENTS;by Cassandra Clare;168 weeks on the list,,ELEANOR AND PARK;by Rainbow Rowell;22 weeks on the list,THE ABSOLUTELY TRUE DIARY OF A PART-TIME INDIAN;by Sherman Alexie. Illustrated by Ellen Forney;17 weeks on the list,DOG SONGS;by Mary Oliver;,"THINKING, FAST AND SLOW;by Daniel Kahneman;",TROUBLEMAKER;by Leah Remini and Rebecca Paley;,THE CONFIDENCE GAME;by Maria Konnikova;,M TRAIN;by Patti Smith;,MY LIFE IN MIDDLEMARCH;by Rebecca Mead;,GEORGE WASHINGTON'S SECRET SIX;by Brian Kilmeade and Don Yaeger;,THE FINEST HOURS;by Michael J. Tougias and Casey Sherman;,YOUR BEAUTY MARK;by Dita Von Teese with Rose Apodaca;,THE FOOD LAB;by J. Kenji Lopez-Alt;,ADULT COLORING BOOKS;by the staff of Coloring Books for Adults;,HOW NOT TO DIE;by Michael Greger with Gene Stone;,THIS TIME TOGETHER;by Carol Burnett;,,THE SOUND OF GRAVEL;by Ruth Wariner;,"FAT DAD, FAT KID;by Shay Butler and Gavin Butler;",I AM MALALA;by Malala Yousafzai with Christina Lamb;,THE OTHER WES MOORE;by Wes Moore;,TROUBLEMAKER;by Leah Remini and Rebecca Paley;,WHAT IF?;by Randall Munroe;,EVERY DAY I FIGHT;by Stuart Scott with Larry Platt;,A WALK IN THE WOODS;by Bill Bryson;
7,THE GIRL ON THE TRAIN;by Paula Hawkins;51 weeks on the list,ROGUE LAWYER;by John Grisham;14 weeks on the list,ROOM;by Emma Donoghue;42 weeks on the list,,,THE BIG SHORT;by Michael Lewis;14 weeks on the list,THOMAS JEFFERSON AND THE TRIPOLI PIRATES;by Brian Kilmeade and Don Yaeger;12 weeks on the list,THE NEW JIM CROW;by Michelle Alexander;105 weeks on the list,THE BIG SHORT;by Michael Lewis;27 weeks on the list,10-DAY GREEN SMOOTHIE CLEANSE;by J. J. Smith;38 weeks on the list,THE SANDMAN;by Neil Gaiman and Dirk Maggs;11 weeks on the list,"THE WALKING DEAD COMPENDIUM, VOL. 3;by Robert Kirkman and Charlie Adlard;15 weeks on the list","TOKYO GHOUL, VOL. 4;by Sui Ishida;6 weeks on the list",,THE TERRIBLE TWO GET WORSE;by Mac Barnett and Jory John. Illustrated by Kevin Cornell;2 weeks on the list,THE PRINCESS IN BLACK;by Shannon Hale and Dean Hale. Illustrated by LeUyen Pham;24 weeks on the list,WAITING;by Kevin Henkes;11 weeks on the list,GIVER QUARTET;by Lois Lowry;105 weeks on the list,,"EVERYTHING, EVERYTHING;by Nicola Yoon;20 weeks on the list",PAPER TOWNS;by John Green;24 weeks on the list,INSIDE OF A DOG;by Alexandra Horowitz;,OUTLIERS;by Malcolm Gladwell;,STRONG LOOKS BETTER NAKED;by Khloe Kardashian;,BLACK MASS;by Dick Lehr and Gerald O'Neill;,THE GEOGRAPHY OF GENIUS;by Eric Weiner;,HOW TO RAISE AN ADULT;by Julie Lythcott-Haims;,RED NOTICE;by Bill Browder;,THE INVENTION OF NATURE;by Andrea Wulf;,HOME;by Ellen DeGeneres;,THE 20/20 DIET;by Phil McGraw;,CREATIVE HAVEN CREATIVE CATS COLORING BOOK;Illustrated by Marjorie Sarnat;,FURIOUSLY HAPPY;by Jenny Lawson;,GO THE -- TO SLEEP;by Adam Mansbach. Illustrated by Ricardo Cortés;,,THE FIVE LOVE LANGUAGES OF CHILDREN;by Gary D. Chapman and Ross Campbell;,BEFORE I FORGET;by B. Smith and Dan Gasby with Michael Shnayerson;,THE RESIDENCE;by Kate Andersen Brower;,EMPIRE OF COTTON;by Sven Beckert;,THE WITCHES;by Stacy Schiff;,THE LUCKY YEARS;by David B. Agus;,ABOVE THE LINE;by Urban Meyer with Wayne Coffey;,THE NATURAL WORLD OF WINNIE-THE-POOH;by Kathryn Aalto;
8,THE NIGHTINGALE;by Kristin Hannah;39 weeks on the list,WARRIORS OF THE STORM;by Bernard Cornwell;New this week,THE CHOICE;by Nicholas Sparks;22 weeks on the list,,,KILLING REAGAN;by Bill O'Reilly and Martin Dugard;18 weeks on the list,BEING MORTAL;by Atul Gawande;58 weeks on the list,YES PLEASE;by Amy Poehler;21 weeks on the list,BOWIE;by Marc Spitz;New this week,THE POWER OF BROKE;by Daymond John;New this week,CAN'T WE TALK ABOUT SOMETHING MORE PLEASANT?;by Roz Chast;90 weeks on the list,SISTERS;by Raina Telgemeier;73 weeks on the list,"MY MONSTER SECRET, VOL. 1;by Eiji Masuda;2 weeks on the list",,THE TERRIBLE TWO;by Mac Barnett and Jory John. Illustrated by Kevin Cornell;New this week,THE CARE AND KEEPING OF YOU 2;by Cara Natterson. Illustrated by Josee Masse;10 weeks on the list,THE BOOK WITH NO PICTURES;by B.J. Novak;69 weeks on the list,LUNAR CHRONICLES;by Marissa Meyer;19 weeks on the list,,WE ALL LOOKED UP;by Tommy Wallach;12 weeks on the list,CRUEL CROWN;by Victoria Aveyard;3 weeks on the list,RESCUE ROAD;by Peter Zheutlin;,EXTREME OWNERSHIP;by Jocko Willink and Leif Babin;,BINGE;by Tyler Oakley;,RED NOTICE;by Bill Browder;,SAPIENS;by Yuval Noah Harari;,ON WRITING;by Stephen King;,FUTURE CRIMES;by Marc Goodman;,INTO THIN AIR;by Jon Krakauer;,HOW TO TIE A SCARF;by the staff of Potter Style;,THUG KITCHEN;by the staff of Thug Kitchen;,"ANIMAL KINGDOM: COLOR ME, DRAW ME;by Millie Marotta;",THE LUCKY YEARS;by David B. Agus;,BOSSYPANTS;by Tina Fey;,,CITIZEN;by Claudia Rankine;,THE COLLAPSE OF PARENTING;by Leonard Sax;,THE NEW JIM CROW;by Michelle Alexander;,GHETTOSIDE;by Jill Leovy;,FRESH START;by Joel Osteen;,QUIET;by Susan Cain;,YOGA GIRL;by Rachel Brathen;,MY SOUTHERN JOURNEY;by Rick Bragg;
9,THE MARTIAN;by Andy Weir;35 weeks on the list,SCANDALOUS BEHAVIOR;by Stuart Woods;2 weeks on the list,TRUTH OR DIE;by James Patterson and Howard Roughan;3 weeks on the list,,,THOMAS JEFFERSON AND THE TRIPOLI PIRATES;by Brian Kilmeade and Don Yaeger;12 weeks on the list,CRIPPLED AMERICA;by Donald J. Trump;12 weeks on the list,THE POWER OF HABIT;by Charles Duhigg;72 weeks on the list,THE BOYS IN THE BOAT;by Daniel James Brown;99 weeks on the list,A PASSION FOR LEADERSHIP;by Robert M. Gates;New this week,THE BEST AMERICAN COMICS 2015;edited by Jonathan Lethem;16 weeks on the list,THE BABY-SITTERS CLUB GRAPHIX: KRISTY'S GREAT IDEA;by Ann M. Martin and Raina Telgemeier;37 weeks on the list,"BLUE EXORCIST, VOL. 14;by Kazue Kato;2 weeks on the list",,CRENSHAW;by Katherine Applegate;18 weeks on the list,FLORA AND ULYSSES;by Kate DiCamillo. Illustrated by K. G. Campbell;13 weeks on the list,DRAGONS LOVE TACOS;by Adam Rubin. Illustrated by Daniel Salmieri;101 weeks on the list,WINGS OF FIRE;by Tui T. Sutherland;11 weeks on the list,,FANGIRL;by Rainbow Rowell;22 weeks on the list,AN ABUNDANCE OF KATHERINES;by John Green;22 weeks on the list,THE SHEPHERD'S LIFE;by James Rebanks;,"GET WHAT'S YOURS;by Laurence J. Kotlikoff, Philip Moeller and Paul Solman;",M TRAIN;by Patti Smith;,STARVATION HEIGHTS;by Gregg Olsen;,THE LOST CHALICE;by Vernon Silver;,HOW NOT TO BE WRONG;by Jordan Ellenberg;,"LIAR, TEMPTRESS, SOLDIER, SPY;by Karen Abbott;",THE LOST CHALICE;by Vernon Silver;,THE KINFOLK HOME;by Nathan Williams;,IT STARTS WITH FOOD;by Dallas and Melissa Hartwig;,ART THERAPY: THE ART OF COLORING STAR WARS;by Catherine Saunier-Talec and Anne Vallet;,BETTER THAN BEFORE;by Gretchen Rubin;,IS EVERYONE HANGING OUT WITHOUT ME?;by Mindy Kaling;,,BEFORE I FORGET;by B. Smith and Dan Gasby with Michael Shnayerson;,MAYO CLINIC GUIDE TO A HEALTHY PREGNANCY;by the staff of the Mayo Clinic;,MY LIFE ON THE ROAD;by Gloria Steinem;,THE SISTERS ARE ALRIGHT;by Tamara Winfrey Harris;,GRATITUDE;by Oliver Sacks;,THE POWER OF HABIT;by Charles Duhigg;,"50 YEARS, 50 MOMENTS;by Jerry Rice and Randy O. Williams;",DESTINATIONS OF A LIFETIME;by the staff of National Geographic;
10,THE LAST ANNIVERSARY;by Liane Moriarty;3 weeks on the list,FEVERBORN;by Karen Marie Moning;New this week,THE MAN IN THE HIGH CASTLE;by Philip K. Dick;9 weeks on the list,,,THE BOYS IN THE BOAT;by Daniel James Brown;88 weeks on the list,MODERN ROMANCE;by Aziz Ansari with Eric Klinenberg;22 weeks on the list,JUST MERCY;by Bryan Stevenson;15 weeks on the list,WHY THE RIGHT WENT WRONG;by E.J. Dionne Jr.;New this week,THE SUSTAINABLE EDGE;by Ron Carson and Scott Ford;New this week,HERE;by Richard McGuire;37 weeks on the list,THE BABY-SITTERS CLUB GRAPHIX: MARY ANNE SAVES THE DAY;by Ann M. Martin and Raina Telgemeier;14 weeks on the list,"TOKYO GHOUL, VOL. 1;by Sui Ishida;31 weeks on the list",,ECHO;by Pam Muñoz Ryan;New this week,COUNTING BY 7s;by Holly Goldberg Sloan;19 weeks on the list,PRESS HERE;by Hervé Tullet;224 weeks on the list,THE MAZE RUNNER;by James Dashner;172 weeks on the list,,ALL THE BRIGHT PLACES;by Jennifer Niven;16 weeks on the list,THE FAULT IN OUR STARS;by John Green;18 weeks on the list,YOU NEED MORE SLEEP;by Francesco Marciuliano;,ELON MUSK;by Ashlee Vance;,THE ONLY PIRATE AT THE PARTY;by Lindsey Stirling and Brooke S. Passey;,GHETTOSIDE;by Jill Leovy;,THE RAP YEAR BOOK;by Shea Serrano and Arturo Torres;,THE ORGANIZED MIND;by Daniel J. Levitin;,THE DEVIL'S CHESSBOARD;by David Talbot;,VOICES FROM CHERNOBYL;by Svetlana Alexievich. Translated by Keith Gessen;,LOVE STYLE LIFE;by Garance Doré;,THE SKINNYTASTE COOKBOOK;by Gina Homolka with Heather K. Jones;,COLOR ME CALM;by Lacy Mucklow. Illustrated by Angela Porter.;,CONCUSSION;by Jeanne Marie Laskas;,NOT THAT KIND OF GIRL;by Lena Dunham;,,YOU AND ME FOREVER;by Francis Chan and Lisa Chan;,THE LIGHT OF THE WORLD;by Elizabeth Alexander;,CRIPPLED AMERICA;by Donald J. Trump;,THE SHORT AND TRAGIC LIFE OF ROBERT PEACE;by Jeff Hobbs;,THE SOUND OF GRAVEL;by Ruth Wariner;,CONCUSSION;by Jeanne Marie Laskas;,BARBARIAN DAYS;by William Finnegan;,COCKPIT CONFIDENTIAL;by Patrick Smith;
11,COLD BETRAYAL;by J. A. Jance;2 weeks on the list,SEE ME;by Nicholas Sparks;15 weeks on the list,RADIANT ANGEL;by Nelson DeMille;,,,ALEXANDER HAMILTON;by Ron Chernow;5 weeks on the list,THE WRIGHT BROTHERS;by David McCullough;33 weeks on the list,OUTLIERS;by Malcolm Gladwell;,KILLING REAGAN;by Bill O'Reilly and Martin Dugard;,THE WHOLE30;by Melissa Hartwig and Dallas Hartwig;,,,,,,,,,,,,,,,,,,,,,THE FAST METABOLISM DIET;by Haylie Pomroy with Eve Adamson;,,,,,,,,,,THE IMMORTAL LIFE OF HENRIETTA LACKS;by Rebecca Skloot;,I FEEL LIKE GOING ON;by Ray Lewis with Daniel Paisner;,
12,ALL THE LIGHT WE CANNOT SEE;by Anthony Doerr;70 weeks on the list,FATES AND FURIES;by Lauren Groff;7 weeks on the list,ORPHAN TRAIN;by Christina Baker Kline;,,,BEING MORTAL;by Atul Gawande;54 weeks on the list,WHY THE RIGHT WENT WRONG;by E.J. Dionne Jr.;New this week,"THINKING, FAST AND SLOW;by Daniel Kahneman;",THOMAS JEFFERSON AND THE TRIPOLI PIRATES;by Brian Kilmeade and Don Yaeger;,MAD GENIUS;by Randy Gage;,,,,,,,,,,,,,,,,,,,,,PALEO PERFECTED;by the editors of America's Test Kitchen;,,,,,,,,,,TO EXPLAIN THE WORLD;by Steven Weinberg;,THE MATHENY MANIFESTO;by Mike Matheny with Jerry B. Jenkins;,
13,ROGUE LAWYER;by John Grisham;14 weeks on the list,EVEN DOGS IN THE WILD;by Ian Rankin;New this week,14TH DEADLY SIN;by James Patterson and Maxine Paetro;,,,THE DEVIL IN THE WHITE CITY;by Erik Larson;14 weeks on the list,NOTORIOUS RBG;by Irin Carmon and Shana Knizhnik;8 weeks on the list,QUIET;by Susan Cain;,ALEXANDER HAMILTON;by Ron Chernow;,FERVENT;by Priscilla Shirer;,,,,,,,,,,,,,,,,,,,,,THE WILD DIET;by Abel James;,,,,,,,,,,ELON MUSK;by Ashlee Vance;,"2,100 ASANAS;by Daniel Lacerda;",
14,JANUARY;by Audrey Carlan;4 weeks on the list,THE BITTER SEASON;by Tami Hoag;2 weeks on the list,THE STORY OF A NEW NAME;by Elena Ferrante;,,,I AM MALALA;by Malala Yousafzai with Christina Lamb;42 weeks on the list,H IS FOR HAWK;by Helen Macdonald;15 weeks on the list,THE IMMORTAL LIFE OF HENRIETTA LACKS;by Rebecca Skloot;,DEATH IN THE CITY OF LIGHT;by David King;,WHAT TO EXPECT WHEN YOU'RE EXPECTING;by Heidi Murkoff and Sharon Mazel;,,,,,,,,,,,,,,,,,,,,,THINNER IN 30;by Jenna Wolfe with Myatt Murphy;,,,,,,,,,,THE SPIRIT CATCHES YOU AND YOU FALL DOWN;by Anne Fadiman;,THE THREE-YEAR SWIM CLUB;by Julie Checkoway;,
15,WARRIORS OF THE STORM;by Bernard Cornwell;New this week,GO SET A WATCHMAN;by Harper Lee;27 weeks on the list,THE READERS OF BROKEN WHEEL RECOMMEND;by Katarina Bivald;,,,WHY THE RIGHT WENT WRONG;by E.J. Dionne Jr.;New this week,THE WITCHES;by Stacy Schiff;12 weeks on the list,CITIZEN;by Claudia Rankine;,ATTEMPTING NORMAL;by Marc Maron;,THE PIONEER WOMAN COOKS: DINNERTIME;by Ree Drummond;,,,,,,,,,,,,,,,,,,,,,"FAT DAD, FAT KID;by Shay Butler and Gavin Butler;",,,,,,,,,,IN A DIFFERENT KEY;by John Donvan and Caren Zucker;,ALONE ON THE WALL;by Alex Honnold with David Roberts;,
