,Combined Print & E-Book Fiction,Hardcover Fiction,Paperback Trade Fiction,Combined Print & E-Book Nonfiction,Hardcover Nonfiction,Paperback Nonfiction,"Advice, How-To & Miscellaneous",Children’s Middle Grade Hardcover,Children’s Picture Books,Children’s Series,Young Adult Hardcover,Audio Fiction,Audio Nonfiction,Business,Science,Sports and Fitness
1,KINGDOM OF THE BLIND;by Louise Penny;New this week,KINGDOM OF THE BLIND;by Louise Penny;New this week,THE TATTOOIST OF AUSCHWITZ;by Heather Morris;13 weeks on the list,BECOMING;by Michelle Obama;3 weeks on the list,BECOMING;by Michelle Obama;3 weeks on the list,SAPIENS;by Yuval Noah Harari;29 weeks on the list,"GIRL, WASH YOUR FACE;by Rachel Hollis;34 weeks on the list",WONDER;by R.J. Palacio;173 weeks on the list,CONSTRUCTION SITE ON CHRISTMAS NIGHT;by Sherri Duskey Rinker. Illustrated by A. G. Ford;7 weeks on the list,DIARY OF A WIMPY KID;written and illustrated by Jeff Kinney;507 weeks on the list,THE HATE U GIVE;by Angie Thomas;92 weeks on the list,PAST TENSE;by Lee Child;,BECOMING;by Michelle Obama;,DARE TO LEAD;by Brené Brown;,SAPIENS;by Yuval Noah Harari;,THE MAMBA MENTALITY;by Kobe Bryant;
2,EVERY BREATH;by Nicholas Sparks;7 weeks on the list,FIRE AND BLOOD;by George R.R. Martin;2 weeks on the list,ELEANOR OLIPHANT IS COMPLETELY FINE;by Gail Honeyman;26 weeks on the list,EDUCATED;by Tara Westover;41 weeks on the list,KILLING THE SS;by Bill O'Reilly and Martin Dugard;8 weeks on the list,BEAUTIFUL BOY;by David Sheff;12 weeks on the list,HOMEBODY;by Joanna Gaines;4 weeks on the list,THE COMPLETE COOKBOOK FOR YOUNG CHEFS;by America's Test Kitchen Kids;7 weeks on the list,PETE THE CAT'S 12 GROOVY DAYS OF CHRISTMAS;by Kimberly and James Dean;4 weeks on the list,HARRY POTTER;by J.K. Rowling;506 weeks on the list,"DEAR EVAN HANSEN: THE NOVEL;by Val Emmich with Steven Levenson, Benj Pasek & Justin Paul;8 weeks on the list",FIRE AND BLOOD;by George R.R. Martin;,EDUCATED;by Tara Westover;,LEADERSHIP;by Doris Kearns Goodwin;,BRIEF ANSWERS TO THE BIG QUESTIONS;by Stephen Hawking;,RACING TO THE FINISH;by Dale Earnhardt Jr. with Ryan McGee;
3,THE RECKONING;by John Grisham;6 weeks on the list,THE RECKONING;by John Grisham;6 weeks on the list,CRAZY RICH ASIANS;by Kevin Kwan;32 weeks on the list,KILLING THE SS;by Bill O'Reilly and Martin Dugard;8 weeks on the list,EDUCATED;by Tara Westover;41 weeks on the list,KILLERS OF THE FLOWER MOON;by David Grann;35 weeks on the list,MAGNOLIA TABLE;by Joanna Gaines with Marah Stets;27 weeks on the list,THE ATLAS OBSCURA EXPLORER'S GUIDE FOR THE WORLD'S MOST ADVENTUROUS KID;by Dylan Thuras and Rosemary Mosco. Illustrated by Joy Ang;4 weeks on the list,HOW TO CATCH AN ELF;by Adam Wallace. Illustrated by Andy Elkerton;10 weeks on the list,DOG MAN;by Dav Pilkey;66 weeks on the list,ONE OF US IS LYING;by Karen M. McManus;67 weeks on the list,NINE PERFECT STRANGERS;by Liane Moriarty;,BORN A CRIME;by Trevor Noah;,ATOMIC HABITS;by James Clear;,ASTROPHYSICS FOR PEOPLE IN A HURRY;by Neil deGrasse Tyson;,THE BIG FELLA;by Jane Leavy;
4,THE GREAT ALONE;by Kristin Hannah;17 weeks on the list,TARGET: ALEX CROSS;by James Patterson;2 weeks on the list,MILK AND HONEY;by Rupi Kaur;138 weeks on the list,SHADE;by Pete Souza;5 weeks on the list,SHADE;by Pete Souza;7 weeks on the list,ANDREW JACKSON AND THE MIRACLE OF NEW ORLEANS;by Brian Kilmeade and Don Yaeger;6 weeks on the list,WHOSE BOAT IS THIS BOAT?;by The Staff of the Late Show With Stephen Colbert. Illustrated by Andro Buneta and John Henry;4 weeks on the list,WOMEN IN SCIENCE;by Rachel Ignotofsky;75 weeks on the list,DRAGONS LOVE TACOS;by Adam Rubin. Illustrated by Daniel Salmieri;248 weeks on the list,DORK DIARIES;by Rachel Renée Russell;268 weeks on the list,SKYWARD;by Brandon Sanderson;4 weeks on the list,WHERE THE CRAWDADS SING;by Delia Owens;,"EVIL HAS A NAME;by Paul Holes, Jim Clemente and Peter McDonnell;",BAD BLOOD;by John Carreyrou;,21 LESSONS FOR THE 21ST CENTURY;by Yuval Noah Harari;,THIS IS THE DAY;by Tim Tebow with A.J. Gregory;
5,TARGET: ALEX CROSS;by James Patterson;2 weeks on the list,EVERY BREATH;by Nicholas Sparks;7 weeks on the list,THE SUN AND HER FLOWERS;by Rupi Kaur;61 weeks on the list,HILLBILLY ELEGY;by J.D. Vance;86 weeks on the list,BEASTIE BOYS BOOK;by Michael Diamond and Adam Horovitz;5 weeks on the list,WHITE FRAGILITY;by Robin DiAngelo;21 weeks on the list,COOK LIKE A PRO;by Ina Garten;6 weeks on the list,THE GIRL WHO DRANK THE MOON;by Kelly Barnhill;48 weeks on the list,THE WONDERFUL THINGS YOU WILL BE;by Emily Winfield Martin;161 weeks on the list,PERCY JACKSON & THE OLYMPIANS;by Rick Riordan;488 weeks on the list,BRIDGE OF CLAY;by Markus Zusak;8 weeks on the list,LONG ROAD TO MERCY;by David Baldacci;,EXTREME OWNERSHIP;by Jocko Willink and Leif Babin;,THE LAWS OF HUMAN NATURE;by Robert Greene;,HOW TO BE A GOOD CREATURE;by Sy Montgomery. Illustrated by Rebecca Green;,SHOE DOG;by Phil Knight;
6,FIRE AND BLOOD;by George R.R. Martin;2 weeks on the list,PAST TENSE;by Lee Child;4 weeks on the list,LESS;by Andrew Sean Greer;28 weeks on the list,SAPIENS;by Yuval Noah Harari;49 weeks on the list,SHIP OF FOOLS;by Tucker Carlson;9 weeks on the list,"THINKING, FAST AND SLOW;by Daniel Kahneman;191 weeks on the list","GMORNING, GNIGHT!;by Lin-Manuel Miranda. Illustrated by Jonny Sun;7 weeks on the list",WISHTREE;by Katherine Applegate. Illustrated by Charles Santoso;53 weeks on the list,THE DAY THE CRAYONS QUIT;by Drew Daywalt. Illustrated by Oliver Jeffers;252 weeks on the list,TO ALL THE BOYS I'VE LOVED BEFORE;by Jenny Han;20 weeks on the list,CHILDREN OF BLOOD AND BONE;by Tomi Adeyemi;39 weeks on the list,THE RECKONING;by John Grisham;,SAPIENS;by Yuval Noah Harari;,THIS IS MARKETING;by Seth Godin;,HOW TO CHANGE YOUR MIND;by Michael Pollan;,FLY GIRLS;by Keith O'Brien;
7,PAST TENSE;by Lee Child;4 weeks on the list,LONG ROAD TO MERCY;by David Baldacci;3 weeks on the list,THE WIFE BETWEEN US;by Greer Hendricks and Sarah Pekkanen;5 weeks on the list,SHIP OF FOOLS;by Tucker Carlson;9 weeks on the list,LEADERSHIP;by Doris Kearns Goodwin;11 weeks on the list,GRIT;by Angela Duckworth;15 weeks on the list,THE HAPPY COOKBOOK;by Steve Doocy and Kathy Doocy;5 weeks on the list,MAX EINSTEIN: THE GENIUS EXPERIMENT;by James Patterson and Chris Grabenstein. Illustrated by Beverly Johnson;8 weeks on the list,SANTA BRUCE;by Ryan T. Higgins;3 weeks on the list,BABY-SITTERS CLUB GRAPHIX;by Ann M. Martin; various illustrators;12 weeks on the list,TURTLES ALL THE WAY DOWN;by John Green;58 weeks on the list,LOOK ALIVE TWENTY-FIVE;by Janet Evanovich;,THE POWER OF HABIT;by Charles Duhigg;,EXTREME OWNERSHIP;by Jocko Willink and Leif Babin;,THE BODY KEEPS THE SCORE;by Bessel van der Kolk;,BOBBY: MY STORY IN PICTURES;by Bobby Orr;
8,TOM CLANCY: OATH OF OFFICE;by Marc Cameron;New this week,LOOK ALIVE TWENTY-FIVE;by Janet Evanovich;3 weeks on the list,THE NIGHTINGALE;by Kristin Hannah;24 weeks on the list,BEASTIE BOYS BOOK;by Michael Diamond and Adam Horovitz;5 weeks on the list,FEAR;by Bob Woodward;12 weeks on the list,MY OWN WORDS;by Ruth Bader Ginsburg with Mary Hartnett and Wendy W. Williams;3 weeks on the list,THE SUBTLE ART OF NOT GIVING A F*CK;by Mark Manson;103 weeks on the list,LOUISIANA'S WAY HOME;by Kate DiCamillo;8 weeks on the list,THE NIGHT BEFORE CHRISTMAS;by Clement C. Moore. Various illustrators;79 weeks on the list,CAPTAIN UNDERPANTS;written and illustrated by Dav Pilkey;147 weeks on the list,GIRLS OF PAPER AND FIRE;by Natasha Ngan;4 weeks on the list,DARK SACRED NIGHT;by Michael Connelly;,A PEOPLE'S HISTORY OF THE UNITED STATES: 1492 TO PRESENT;by Howard Zinn;,PRINCIPLES;by Ray Dalio;,BEING MORTAL;by Atul Gawande;,BELICHICK;by Ian O'Connor;
9,LONG ROAD TO MERCY;by David Baldacci;3 weeks on the list,NINE PERFECT STRANGERS;by Liane Moriarty;4 weeks on the list,ALL THE LIGHT WE CANNOT SEE;by Anthony Doerr;61 weeks on the list,LEADERSHIP;by Doris Kearns Goodwin;11 weeks on the list,BRIEF ANSWERS TO THE BIG QUESTIONS;by Stephen Hawking;7 weeks on the list,JUST MERCY;by Bryan Stevenson;132 weeks on the list,SALT FAT ACID HEAT;by Samin Nosrat. Illustrated by Wendy MacNaughton;10 weeks on the list,MINECRAFT: THE CRASH;by Tracey Baptiste;16 weeks on the list,"ROSIE REVERE, ENGINEER;by Andrea Beaty. Illustrated by David Roberts;143 weeks on the list",MISS PEREGRINE’S PECULIAR CHILDREN;by Ransom Riggs;106 weeks on the list,WHAT IF IT'S US;by Becky Albertalli and Adam Silvera;8 weeks on the list,EVERY BREATH;by Nicholas Sparks;,THE DICHOTOMY OF LEADERSHIP;by Jocko Willink and Leif Babin;,GRIT;by Angela Duckworth;,"THINKING, FAST AND SLOW;by Daniel Kahneman;",FOOTBALL FOR A BUCK;by Jeff Pearlman;
10,LOOK ALIVE TWENTY-FIVE;by Janet Evanovich;3 weeks on the list,THE NEXT PERSON YOU MEET IN HEAVEN;by Mitch Albom;8 weeks on the list,A DOG'S WAY HOME;by W. Bruce Cameron;New this week,FEAR;by Bob Woodward;12 weeks on the list,ASTROPHYSICS FOR PEOPLE IN A HURRY;by Neil deGrasse Tyson;75 weeks on the list,THE BODY KEEPS THE SCORE;by Bessel van der Kolk;6 weeks on the list,CRAVINGS: HUNGRY FOR MORE;by Chrissy Teigen and Adeena Sussman;5 weeks on the list,"MAC B., KID SPY: MAC UNDERCOVER;by Mac Barnett. Illustrated by Mike Lowery;2 weeks on the list",THE SNOWY NAP;by Jan Brett;3 weeks on the list,THE LAST KIDS ON EARTH;by Max Brallier. Illustrated by Douglas Holgate;13 weeks on the list,THE POET X;by Elizabeth Acevedo;5 weeks on the list,KINGDOM OF THE BLIND;by Louise Penny;,21 LESSONS FOR THE 21ST CENTURY;by Yuval Noah Harari;,THE MAGNOLIA STORY;by Chip Gaines and Joanna Gaines with Mark Dagostino;,INFINITE WONDER;by Scott Kelly;,UNBROKEN;by Laura Hillenbrand;
11,NINE PERFECT STRANGERS;by Liane Moriarty;4 weeks on the list,ELEVATION;by Stephen King;5 weeks on the list,THE 17TH SUSPECT;by James Patterson and Maxine Paetro;4 weeks on the list,TRUMP'S ENEMIES;by Corey R. Lewandowski and David N. Bossie;New this week,TRUMP'S ENEMIES;by Corey R. Lewandowski and David N. Bossie;New this week,KITCHEN CONFIDENTIAL;by Anthony Bourdain;61 weeks on the list,,,,,,GOOD OMENS;by Neil Gaiman and Terry Pratchett;,"THINKING, FAST AND SLOW;by Daniel Kahneman;",,,
12,WHERE THE CRAWDADS SING;by Delia Owens;12 weeks on the list,TOM CLANCY: OATH OF OFFICE;by Marc Cameron;New this week,CHINA RICH GIRLFRIEND;by Kevin Kwan;19 weeks on the list,ASTROPHYSICS FOR PEOPLE IN A HURRY;by Neil deGrasse Tyson;65 weeks on the list,HINDSIGHT;by Justin Timberlake;5 weeks on the list,CODE GIRLS;by Liza Mundy;8 weeks on the list,,,,,,HELL DIVERS IV: WOLVES;by Nicholas Sansbury Smith;,FEAR;by Bob Woodward;,,,
13,DARK SACRED NIGHT;by Michael Connelly;5 weeks on the list,DARK SACRED NIGHT;by Michael Connelly;5 weeks on the list,PACHINKO;by Min Jin Lee;39 weeks on the list,BRIEF ANSWERS TO THE BIG QUESTIONS;by Stephen Hawking;7 weeks on the list,THE LIBRARY BOOK;by Susan Orlean;5 weeks on the list,ALEXANDER HAMILTON;by Ron Chernow;106 weeks on the list,,,,,,KINGDOMS AND CHAOS;by Kel Kade;,BEASTIE BOYS BOOK;by Michael Diamond and Adam Horovitz;,,,
14,SOMEONE TO TRUST;by Mary Balogh;New this week,WHERE THE CRAWDADS SING;by Delia Owens;13 weeks on the list,SOLD ON A MONDAY;by Kristina McMorris;6 weeks on the list,THE LIBRARY BOOK;by Susan Orlean;5 weeks on the list,THE MAMBA MENTALITY;by Kobe Bryant;5 weeks on the list,HOMO DEUS;by Yuval Noah Harari;New this week,,,,,,ARTEMIS;by Andy Weir;,SHIP OF FOOLS;by Tucker Carlson;,,,
15,ELEVATION;by Stephen King;5 weeks on the list,BEAUCHAMP HALL;by Danielle Steel;2 weeks on the list,THE WOMAN IN CABIN 10;by Ruth Ware;71 weeks on the list,JUST MERCY;by Bryan Stevenson;11 weeks on the list,CHURCHILL: WALKING WITH DESTINY;by Andrew Roberts;3 weeks on the list,BOY ERASED;by Garrard Conley;4 weeks on the list,,,,,,THE OTHER WOMAN;by Sandie Jones;,UNBROKEN;by Laura Hillenbrand;,,,
